reviewId,userName,content,score
7a5bb480-8a17-43d5-b3a1-650a803dbc05,Prakash S,"one of the worst app in the entire world, when we are in hurry to book a ticket, the screen just says pin in validation for hrs",1
74efd75e-2b6b-4377-a90c-c60656ac8619,harish thanvi,comstantly getting login issues. Its the only APP and still showing so.many issues.,1
2c6ca9d9-d8b0-45ba-9da9-5f03b2cb702f,Onlyannu Dubey,not open even in late night bogus app,1
e8a256bf-4d78-4804-a165-c99f5c1f920e,Sahil Bansal,Doesn't work half of the time. Not able to login since 2 weeks. Pathetic service.,1
b2a30dc4-0942-465a-b51b-f0959508b45e,ABUZAR MALLICK,login problem,1
bdffaa72-9016-4123-a23f-9e1f4d2ee7e2,Jitendra Patel,not able to get confirm tickets online by ourself ticket show all ready Booked this app is not for us to book tickets easly bakvas app is is all tickets are in waiting list and tatkal ticket you not able to book Life time from this IRCTC app,1
33c8ea75-4c1e-4275-8f8f-04318f50bef2,Gopinathan Ramu,"irritating nowadays days. buffering at ""validating pin"" message pop up. After three times closed and opened then only opens. admin pl attend and solve the issue.",2
c13cead5-7b54-41ed-b23f-8ff7bc905789,Shashi Prakash,login issue,1
54ba8607-b030-482e-bbae-2b4a7bcf57dd,justin duraipandi,super,5
e4a41824-f993-49aa-97a8-6e259265007c,Anil,waste of time,1
55df83e5-4b3e-4c0a-b2f3-aa5e6dc15d96,Lakhan Pahariya,Very good nice app,5
ebc96233-876b-4488-9d4d-3adce178c51c,Tushar Pandey,day by day it is getting worse in every update. app not opening,1
a71efdeb-4dff-42d7-a9ee-d99b1060931e,Munna Kumar,nice app,5
39382287-5890-45ca-8d1e-122d0fb5cede,Santhosh K Jose,worst app.once the password is expired and I cannot renew it.,1
a9e0873c-f70f-4758-9330-8d19d5696987,Rahul Bisarya,unable to login,1
898942f4-e3d5-438f-b093-15bd4ec649ab,rahul s,everytime says validating pin and waits for ever,1
dc23cfe8-0a0c-4119-bd0c-0993953d2ecf,sandeep Singh,nice,5
65b4faf9-9613-46e7-b3d2-7977f9f5e2be,Farzaan,Best Indian App for Railway Ticket Booking 😄,5
c8ee6cb4-9183-4cda-b49c-623fcbf1a65c,Dr ankit Gunaya,Easy to use,5
75b5b017-0278-40fe-add3-7f35af901034,monotosh hazra,"can't book ticket with this app, in proper time. can't able to login with this app in time. very disturb and disappointing.",1
e1f70359-2517-4893-8ca2-cacc410202e5,Monti jha,bed performance 😡,1
6714f8b6-651e-4134-9886-f623f7603c08,AROMAL SUDERSAN,app not logging in please help,5
d944e102-f53d-4702-bebd-d12771865521,Ravikumar Tiwari,not able to login.. everytime I have uninstalled app and then again login..after setting up pin and enabling biometric next time it's doesn't log in,1
947d0619-7d02-4782-8bbe-24f7fc8a76cd,Himanshu Vaghela,login issue not able to login,1
9e0cd916-1fb5-4b8f-b05e-c7caf0a5a6ff,sharath vadnala,unable login application,2
a9f33d3e-80fc-4a7c-b636-21a5cb44d3cc,Vipin Kumar,good good,5
dac8308a-6ff8-4cb8-9df0-592e74e69510,varsha prajapati,Experiencing worst at present 😩,1
0ac36682-7bc1-46ad-8c71-76c00319c643,colin dominic Johns,You should have 1 login for airline ticket and tourism as well why do we have to down a separate app for each service. More over it does not have a round trip booking option for rail tickets. It does not tell you the features and benefits that are available on a particular train so if you could add that it will be great. You call center number does not get connected at all it always says busy so you need to enhance that. Get a better developer for this is 2025 grow up,1
326bc576-ffed-48c8-b705-ea922fd7d54a,MS,don't know what happened to this app every time I have to uninstall and reinstall else it will hang while trying to open. already cleared caches files etc but nothing is working,2
dcff7fbd-0976-46d8-8c25-b0c943d70668,Bornali Das,Very bad,1
97c2bb43-b71e-4efa-9981-d129cc09d5f5,Hardik Shah,"Login taking time like forever, at last need to force close the app. This is after last update. if can't solve the bug, undo last update, after that re-installing app will be better",1
d66049e2-7c52-4b3e-8d9f-629b66d6f2c2,Yash Panchal,showing Validating PIn for so long.... I am unable to book tickets from pas 2 weeks,1
30944e7a-8ec9-4fb4-9e0f-b1db14f90e07,ramesh pala,good,5
8ee267db-2b05-45c5-8422-e2e166c559e6,Sajid Sanadi,"They hired bunch of monkeys to develop this app, Sorry.. even monkeys can develop better app than this",1
ece60bf2-3737-4a4c-9566-5a041734be79,Neeraj Prasad,very bad experience because this app of always server is down,1
7e55630b-2550-476e-9c82-95a0055030ca,Sayani Sarkar,"i hv been trying to authenticate user via adhar no but i am unable to do so repeatedly.error msg pops ""unable to process your request""..thus I am unable to book confirmed tickets too.",1
7e5831fb-a44f-4606-bfa5-4d42e4a578f8,varun kumar singh,very bad service,1
10fc705a-f9da-44b4-9c34-5845124094f4,Gaurav Dimri,"The app has been giving log in issues for a few weeks, unable to access the account on the app, I m able to access on Web",2
066e9c0f-4e8e-42a1-b88a-902eeeaf9aaa,Jaikishan Pasi,not taking password,1
0ae2fc6e-32d3-4952-9dd4-301b824c7637,Bhavanarushi,not opening app recently onwards please do it for fast login,1
6f2c020d-a965-4751-a442-f3f408ce454b,Mahendra nadh GORLE,not signing in easily,2
a5efdc8a-f992-414c-8efe-86cf3af61f3b,THAKURPRAJWALSINGH,worst app ever used,1
6ebcf97b-0aef-49fa-9c13-b3a214b1f410,sagar mankar,not work,1
53489a9f-5719-4a05-980e-77d04729103a,Akash purohit,"Worst App ever. this is what happens when there is monopoly in market. slow app, regular crash, unnecessary Ad.",1
984bf5e0-c899-407d-96e9-78b082984b59,Sridhar A,very Good,5
74b84bc2-eeae-4f5a-86a4-b78107eaf25c,sri s,App for last 10 days not opening despite reinstalling multiple times. It keeps spinning after biometric and then goes to login page again,1
365c2b83-48c3-4e0c-9d0e-c487e7ceac36,Dr Sandip Udawant,"Even though train is available between Hyderabad and solapur it is showing train not found? Need some serious fix. Also overcharging quite times in takal tickets Update-Nov 2025. Google-pay payments failing. Try later, not working when tatkal is needed. Need improvements.",2
dfe2cf23-5624-49af-b423-5c46df585410,Ahmad Alam,thank you IRCTC,5
a67f646a-c62e-41e9-9c7a-de220671f4d7,Manjeet Karnani,only it shows a validating pin....,1
b52fc5ad-6a7d-47b4-8858-9ce7afbf3521,Vishnu Rai,very slow app,4
3f58ae44-892f-4b7b-ae32-f2efe7355d3e,Umesh Kumar,"poor app. you need to put your pin twice. doesn't work at one go. during Tatkal/premium tatkal it's even more pathetic. Authority need to care. in an age of AI, you can not be like this.",1
d47af3be-392f-4fa4-8216-7d6efa610c0f,Priyankar Pal,extremely poor service.,1
2b236c61-d3e4-450d-9e30-1283c4efe3d4,Yatin Jayawant,1.11.25: App doesn't move fwd from validating pin page. Its latest version..--X-- Rating is because of too many advertisements. As such app is good and helpful. Have a way to resend text message.,1
37a57ec1-be69-404b-980e-167df713d395,Dipendu Khan,Can't go past from validating pin,1
57f4df9a-e330-4b26-9251-8fd31ace6a2b,Bismilla Banu,"last update one worstes update, Tatkal Ticket Booking unable to process, or IP client error. waste",1
2c2ed2bf-4c7e-4ca4-b371-88b2bdc3c739,Sachin Chotaliya,Nowadays too much problem for login and validating pin 📌 like tha showing,1
d1cfdb7d-0cc7-43e5-ba1c-d9fc776c6d7c,Sushant Kumar,pin validation been worst after last update on S24 ultra.,1
aae18af0-5166-4892-869b-cf3e99299220,Gaurav Chauhan,poor,1
3cdb766c-fcf8-4b71-b2dc-6d76e87b00f7,Chandan Sethy,ticket proses very good thank you for Irctc rail connect.,5
31d5a607-0359-47ac-aa21-5e3694879d79,Parth Herbaceutics,"is anything problem, since last 2-3 days app not opening",1
42524086-69fd-4caf-846e-cc55a3ce98e9,Chandrasekar Jayaraman,"after entering login details, couldn't able to login...just loading and failed",1
adfcfdbf-7c75-434e-bd27-c354467e7503,Ramachandron Aiyar,of late has become very dlow,3
c6c75818-5649-43f5-bcbe-11630fba4f95,Neha Kumari,very bad app.... tickets didn't get confirmed after getting vikulp option,1
7d85a1c8-e60d-467e-bf97-32e26699e992,ANISH KUMAR,best apps,5
47a096c7-d041-4871-bf2d-870914a88994,swapnil larokar,"from this diwali 2025, I am trying to authenticate aadhar but it shows error or sometimes said failed. tell us how then we will authenticate aadhar and use app for tatkal tickets.",1
91216599-e178-49ae-a3d0-c363ab62f987,Sk Ismaile,good,4
93b5e087-5b92-4c00-805f-9f880d2f17cc,Ujjal Gupta,The app doesn't even open.... absolute shame,1
d2509507-b22e-4467-944a-06293e542e4b,Amaresh Mohanty,"The booking system is deeply flawed.. MOST USELESS IT Mgmt! NEEDS PRIVATISATION. You want to torture yourself mentally, then pls use IRCTC train booking... New non-sense innovation is aadhar authentication and the system doesn't work easily and then your quota is done for the day...try next day ...super!",1
18f239fd-2adb-4b7d-8696-141a77e87de3,Shweta Jinia,my app is not working at all.. for every time i am opening the app is hanging and all time i have to uninstall and install for every transaction. continuously i am asking for help but no solution till now.,1
816e9291-0b24-4a96-b4c9-b590314e299c,Surabhi Sahu,worst app.it is not opening since 15 days.. everytime I need to uninstall it then it opened for once only...if I try to open 2 3 days later again it just verifying for so long n showing error..n I am talking about normal times...n for tatkal it's ....like bhool jao ki koi TKT v milega....,1
92f024f4-314b-445c-8ca6-f2ed07a15f1a,sachin damor,Login Issues persist....,1
3e6a3ddc-a7fe-49f5-a000-5c43a4fadecc,Shrayan Raha,unable to login its showing validating pin for a long time,1
c75a38c2-c461-4022-b898-e8a6da2daccc,C S,"Whenever booking a Tatkal ticket, the amount gets deducted from my bank account within 5 to 10 seconds, but the system buffers for about 3 minutes and finally says that the ticket was not booked. After the amount is deducted, it takes too long and still doesn't confirm the booking. Can't even go back to book without any confirmation",1
455c62c9-1a1c-4b3c-b436-3e2c9cabffe9,GSS SERVICES,thank,5
7521ecb3-8ad9-479c-98db-344df2c54cd8,Praveen Kumar,irctc has many problems..,2
471d97e8-b603-4c38-baea-70e8088655b4,Akash Gupta,very bad experience,1
8193aaaa-835a-4908-abc9-7ec75a087f49,Lala Ram Choudhary,all over okay,5
a5d93a41-9c22-438d-a923-08566f0f0cc5,p.K,I am trying to book tatkal ticket from 3 day and every time its saying connection error but after 3 to 4 min the app is working very smooth All the problem arise when tatkal seat are available and when seat is not left all such problem is over since 3 day same problem is happening and my father saying me nalaykh(worthless) because of this. So please tell me how i convenience my father that its not my mistake or connection problem its app problem Reply the reason which convenience my father,1
1f9a48f6-ada5-480c-85cf-c2da3f334c30,Priya Mahanta Sharma,what is the use if we can't even log in it keeps on validating the pin only,1
2825af68-61bb-470e-8840-5c9fd4bf1353,sandip kedia,app is taking too much time to login but not able to login...need to book tickets but can't Book because of login issue,1
cb89d722-aa3d-4657-a886-ce220a7e663a,Sanu Ojha,"very poor not working only buffering, previously it was good but from 10-15 days I can't buy a ticket because app is stopped working in my phone even though I have done my kyc adhar verification everything but still not working",1
8ab1dd5a-6cfa-4304-ba73-844ae2d0bbf6,ashish kumar,app not working properly,1
ef894a5e-cdc5-4762-b93e-f9e02b1262d5,Reepu kumar MAR,nice app,5
48078245-be2e-449c-8a07-b92c86c816c6,Sujal Harsh Ranjan,Not getting pin validated to do login,1
fbe95c23-be28-4440-be81-c2ca571da904,Bhupendra Arya,"At the time of logging in the app after I have entered my credentials its has been showing 'validating pin' continuously for 5-10 mins. I have been facing this issue from the last 2-3 weeks. IRCTC has made the systems of password setting, pin, email etc so strict that it cause so much of inconvenience and after all that there is again this failure. i swear if there was some other alternative of this app then I would have used it but the thing is that indian railways have monopoly",1
acaf8ceb-2626-4bea-b1d0-a99b4e75656d,selva kumar david,much better,3
85d93ac4-ee3c-4b4d-94ef-9216108713fb,mahesh vasamsetti,always showing validate pin... MC app... seriously irritating while booking...it's better to privatize this services...,1
fd7288f1-f995-403f-b926-88f24ab4e0a9,naveen kumar,"very worst app, required update",1
609e18c4-507d-4380-9bd8-c13fb00636ad,Vishal Bansal,App not login... Validating pin.. Problem please resolve this issue,1
2221b9fb-0336-45c8-a6eb-c3474ee28188,Anil Vishwakarma,"very pathetic service to check seat availability every to have to uninstall and install this pathetic app, please work on this.",1
f5410640-7597-40f9-a533-52c8b0c3f1ae,Abhishek kumar Pathak,login problem progress,1
84bc28be-b755-4709-93ab-3f89cbc1769f,Dharmesh Moridhara,very bad app. gatar chhap app from gatar chhap railway system....kha thu...when try to get app...it shows validating pin....then nothing is going to happen.....app from India most...currupted people...,1
bb6fe67a-d4c8-4ae8-ad1d-1ee556a7cd71,IRAM FARHEEN,Preg and female pref lower birth dena chahiye...jaise ek column hai na ki allocate only when births are confirmed..waise hi ek preg female aur allocate only when lower birth are allocated wala box ho opt krne k liye...ek aur prob hai ki irctc walo tatkal booking k time tm jo ticket pending rhta h usko pending hi rkho ..dusra book kr leta h insaan aur paise do ticket k chl jate hain...,2
ed74455e-0248-4a8d-aae0-4e85f1937c52,Rudra pratap Singh,worst app,1
3850658f-1778-4ab5-96b9-1152abbd976d,MAHENDRA JAISWAL,when I try to login it says validating pin,1
68ee49af-a36a-46db-bc2c-7d39be282833,Sumit Kumar,worst app,1
8e8fe4ad-061b-40c6-924c-28d9d860c882,mahesh Kumar,good,5
09a94182-38a1-4c65-9736-27ef013509d6,Krishna Kumar Sharma,"ek saptah se try kar raha hu , kbhi login nhi hota hai fir jaise lgta hai server hamesa hi down rahta hai ! worst app hai ya koi scam chal raha hai yaha !",1
3bdc0d45-4e25-4130-8d1b-dcbb86b81960,Mohammed Abdurraheem N,It will search trains after the holidays are completed and May be sold to private companies,1
cec8fe40-f4eb-472d-a3ec-fffbb66035de,basavaraj pujari,not logging in after entering password and captcha too,2
c2c5de8b-8762-401e-ac22-4053b181d444,ram pratap maurya,too much problem booking ticket and at last not booked,3
6e2e46b3-509b-4c8d-91ae-481a1181df8b,Angi Angaline,not able to login and view the tickets after the update.,1
daeaa44c-6c1b-476a-87ea-4b89e4517678,Gaurav Kumar,always shows error while booking the ticket or in tatkal app freezes like an ice.,1
1f125c85-eab1-4b94-87e9-eb5df4a4c3a3,Shobhit Kumar Gupta,"it takes too much time to login,",1
2b018f23-7c01-479b-9393-8e2b73b9880a,sagar kodad,not good,1
afd06c39-0ad2-4774-9400-f8c60538652d,Ramsharan Kumar,"Fantastic experience! I spent 10 days learning how to fail at honest Tatkal booking. Then one agent taught me the real shortcut — pay extra and get instant confirmation. Feels great to see how smoothly corruption runs while apps crash and rules keep changing. Indian Railways should win an award for teaching patience, helplessness, and sarcasm all at once.",1
ae7ee4ec-f9b5-4265-8c5c-bd47bfa52867,Shumail Khan,great,5
6abda469-f9a0-4440-93fb-d440e237fbec,Anwesha Mitra,I am using this app since 2018 and Now a days this app has become worst and the number of tickets also are not showing!! What about this kind of glitch in an official app? Then how I will book the ticket from this ?,1
129157e9-84d0-48b8-9fb8-8984f0c9670b,Umesh Chatare,Second worst app... First still retain by IRCTC website,1
196facae-7a47-4079-a3fb-938ff88b0397,Ankit MIshra,not working properly,1
494617da-899b-42a3-8030-b44602cf3753,Samuel Maria Sebastine,app mostly not working on android phone,1
8f2dd3a8-230a-48d8-95b5-587868b4a746,Arvind Tomar,one of the shittiest app. every time you Open the app you need to login and sometimes login can take a day,1
e872a678-877c-4bb2-9eeb-ccd8edec3aa4,Vinit Ranjan,Login not working. It keeps showing the message Please wait.. Issue not resolved since I checked last time one week back.,1
79916b65-61b1-427f-a504-a1a1ff04082c,Chitta Rajak,good,5
0c056768-9325-41b7-b0f9-65e52d7e99f9,Pankaj Jha,"Disgustingly bad app, as far as registration and captcha is concerned",1
4566045e-e212-4c0f-95b0-021fa70b27ad,anjali basrur,very slow and always creates trouble while booking tatkaal tickets,1
2f589918-daea-4794-aa2a-ed0ee9b290a2,Siju,Crazy app. Full of advertisement. They are making money on AD also. they are not bothered about customer facing problem in login and slowness but they have put full of advertisement on all the screen and loading the app,1
ac56e1e6-bbc8-4258-95a2-3185c41c8341,TheITMantra,the app has stopped working properly after update kindly fix...it keeps on saying validating... Don't allow to log in ...is this a special arrangement for agents only ..,1
64fd6188-a1e8-44d6-b859-ec7af81258cf,Quaint Chandan,This app is getting worse with time and In the name of the facilities the app is making us fool. Whenever I enter the Password to open the app. It shows the Validating process for minutes and then demands a password again. Fix the issue asap.,1
298c1496-943d-447b-b2db-aab3a58faadf,Manish Kumar,good app for rail ticket,5
79951f63-bb76-4c22-a633-053819dbd89a,Sandeep Kingrani,bad network slow website application,1
e2df1451-2708-405b-8a6d-78cb1374e1b8,Fff Ansari,adhaar authentication completed already but it still shows that go to account and authenticate adhaar very bad experience i didn't complete my booking due to this glitch,1
ead1d217-7736-4a3c-8a75-b22ba1b81c90,Gokul Sms,login issue,1
5bd00c3c-b8f7-414f-a34a-a4a47008e9ed,Deepak Panwar,"very bad experiencing this app ,not properly working at the time of tatkal booking that's why my tatkal booking always leave",1
9efa0f4c-c314-40df-b7fc-a669ddf74a54,JOHN D,one of the worst application I have ever seen during Tatkal they will deduct money without giving booking confirmation and will return money within 4-5 working days with extra Tatkal charges. IRCTC running with these charges only.,1
64cd2796-4e60-47d6-ad6c-48fc41a3c54d,Pankaj Bhabal,My profile is aadhar authanticated still app gives a pop up saying that you need to authenticate your profile for tatkal reservation and not allowing me to proceed for tatkal tickets. What the hell is this ?,1
67723e3b-9e09-4adb-a00b-39634512e175,nanu kamdar,👍good,1
94f1709f-4b26-45b8-8a05-2f6637b31a55,Karn Singh,Very poor response at the moment. Validating PIN is displayed on the login screen but login is not happening.,1
393d16d3-e009-486e-80cb-bdad988a6dbc,Ram Pratap Singh,For tatkal time app not working,1
8f660425-e1f1-4b2e-b590-c8f9f3b9968d,Vandana M,Never ever opens to book the tatkal tickets. Always shows error even after registering with Aadhaar. worst app,1
967e0bac-c819-4f26-9046-78eb2e62e641,Amrendra Kumar,"worst app of irctc every time the app shows 6-8 mins for login and during tatkal booking show "" There seems to be a connection issue with your request. please try after some time"". after 7 to 10 mins found ok. means that app crashed during tatkal booking.",1
32a68ef1-76c9-44de-91a2-2675845be03e,G Peniel Jacob Paul,Such a worst app,1
04ec44c0-e9e4-44ff-ac46-0d3503225cd7,Vishvraj Bhadauria,"Today I tried to book an instant ticket on the IRCTC app but the ticket could not be booked, so you should try to fix it as soon as possible. If there is any load on this app then try to reduce it. 🙏🙏🙏🙏",1
5e7db206-2ae7-41df-9238-5b47f707982f,ganesh mote,"एक नंबर फालतू आहे वेटिंग तिकीट देऊच नका 60 रुपये खायला देतात वाटत, 5 मिनिट सर्व्हर काम करत नाही प्येमेन्ट होतो तरी तिकीट कन्फर्म होत नाही",1
02f54876-db69-40ef-966e-ef8a9dd1a129,Vivek Kumar Singh,"worst app ever , it's better to use third party apps to book tickets",1
2752cb1b-e061-4ac8-a469-0adeb225a0a8,ssp enjoy,open nhi ho raha hai please wait kar raha hai,5
9f665b4c-73d5-4a13-88d8-3a9fe3946bb9,Rajesh Paridala,Login Issues with this app nowadays.,1
760f3c20-944b-4ada-80b7-98ef5cc2f3f5,Atul Raj Vardhan,We are experiencing very bad experience with you at the prime time of ticketing 😠🥺😒🙁😔,1
184353bb-98ec-4bdc-b9bd-4213d74a31a3,krish chauhan,Corruption pokes it's nose here too.,1
d6e9ad4c-1d51-4fe4-8263-5e5a8f67ccf3,Sandeep Raz,tatkal ticket ke samay ye app automatically logout ho jata hai,1
095cfe15-4f6d-47d8-8cc1-00252e1f4d91,Anuj Sharma,"this app is good but in some cases it shows problems while booking Tatkal tickets the app automatically logged out, while using Irctc wallet the payment process takes time and provides tatkal waiting in many cases the login process takes to much time in Tatkal cases",3
84bea393-0887-4572-8829-30f5500d955a,Sanath Kumar,wrost experience,1
ebb2758b-c51f-4c5a-bfb6-63d236163a06,Priyatosh Sahoo,app is not working properly and having issues after the aadhar verification.,1
a8df7199-3352-44bc-92c6-ee175af0f04c,DHAVAL SHAH,there is a lot of error to use application ticket not Book easily in this web,1
0ef8eda7-9c17-47b3-826f-b71a1688e8b2,Sanket Tangade,bohot hi ghatiya app hai,1
90a0449b-d627-4407-b0de-fb2e15a17099,Nitin Kumar,"Pathetic app, designed for brokers with special privilege to book tickets and sold at a higher price. The general public cannot book a tatkal ticket, either they won't be able to login or it will be stuck on the payment step and only will start working once all the ticket finished. People are getting befooled. App developers must have given some privilege to brokers.",1
272a2adc-de9d-49f4-b0ff-6fd9c6aa6dec,SWAMI GAMER,Each tatkal ticket ticket sold to fraud ways with the behalf of railway ministry and his staff 🤫,1
37ebb21a-7b7d-4e82-b5a7-d1b74cd7ff82,Sunny Kumar,nice app or ticket booking started hote hi ticket waiting ho jate hai,5
a4433412-642a-4cbd-9885-448ab21da8db,Paresh Bhardwaj,login issue,1
1384f81f-94ad-48c1-a290-e4aaab3bf256,Sharad Kumar,Always getting problems with tatkal booking. Connection error or automatic logout.,1
ea2d835c-3714-40a0-bbfe-c980cfe90474,Philip Thomas,Does not open the app. Too much delay,1
8be71fb9-01a7-4853-91d6-a4c136f2af08,AADI RAJAK,bad experience server issue 🤷🤷,1
e41e20ac-969d-487f-8fab-15e5c94b6597,Arun Kumar (akvh14),worst railway in the world 4 hr delay and tatkal booking is a hectic one,1
02f7bae7-2af3-4fbb-aac5-720338a3fbd7,Pavanteja Vanam,worst application,1
190bc122-cd22-4f63-94b3-b3a23b325e90,Farhaad Aalam,very bad experience,1
b1d9da84-5543-44f1-b704-0a6f6977720d,Rohit Kumar,sabse bekar apps,1
7ef9c587-09e2-4a2c-b7b4-1e0e2f93ff18,Arun P,this app is only working for booking general tickets...we can't able to book tatkal tickets ..always showing network issues...vary bad....,1
820b1d2b-fb0a-48bb-94f1-d4730ad6e9da,Rajesh Hadagali,useless app for tatkal bookings,1
9003503b-f291-4d59-a18f-933ef0dfc270,Amol Gawai,bakwas application my rating (-5),1
b095123a-3162-4d4f-8545-42167b38cedd,RAVI SHAW,not open this aap many times login..,1
cbc77529-f736-4461-b8c0-2eafc451dc05,Asd Zxc,Just validating a pin takes one day. It's the worst app that I have used,1
66c40403-2b85-499a-8e69-5fd6f6ebcdab,Kunal Nimkar,worst experience,1
b63f49f7-ced8-41ab-83c9-7107717479af,Ritvik G,worst app for booking,1
88a823c1-e2a5-452c-a1bf-2953ba3f7d1f,bhavesh sharma,not working after the update. it's just shows the validating pin. it's getting worse with every update.,1
5699e5ba-57e6-4b45-879b-36243289ee99,wasi imran,when I m trying to book tatkal is shows there seems to be connection issue with your request.please try after some time. this is a very frustrating if u r planning by train by booking tatkal rethink your plans,2
77596e7f-daa2-47ee-b75b-e50330175a71,Sapna Arya,"I had a terrible experience at Haridwar Railway Station's ticket counter #4 on October 28th. I had a 1 AM train to Haldwani and I went to the counter around 12 PM to buy a general ticket. When I offered to pay online, the staff refused, insisting on cash payment despite the signboard clearly mentioning online payment acceptance. I was made to wait for over 30 minutes, and despite my repeated requests, the staff a again that I finally got my ticket. The lack of customer service and disregard",1
81d18b66-9c9d-4951-a843-189bf50a6aee,Joyo Chintada,it's very worst app I'll never recommend anyone else to use,1
0d7b086a-0732-462d-916c-9c1676989195,Sharma Vikash,good application,5
7d30d987-cd90-49eb-872f-afc3f26dc358,THE ENTERTAINERS,login issue in my phone.....,1
4264958e-98d5-429c-a66f-fcdbbb073e56,Shahbaz Kibria,I am not able to login to the irctc mobile app. It kept on checking credentials always.,2
c41468f7-8164-4f15-bc3a-b2e59bbc510a,Aditya Mallick,network problem and technical issue tatkal time why .only 1 minit time but all tickets book why indian rail please help all indian man,5
c345aee5-6bc4-4306-8e54-465e95728378,Govinda Taori,worst app of the century,1
11ee66c7-f170-449f-a577-b93a51136b21,ciel ciel,pathetic app. it's just stuck at login page,1
bd427b8b-f29f-45ad-b3ef-24af2c6e3575,Arvind Maurya,Lately the app is unable to authenticate users. just keep saying Validating.,1
a8beb0e3-5c19-442a-a140-06df55d40860,Srinivas Rao,"Using the IRCTC app feels like waiting for a train that’s always “just about to arrive.” Maybe it’s time to simplify instead of complicate—because right now, booking a ticket feels like a test of patience, not convenience.",1
