reviewId,userName,content,score
8eb9c1c2-c8cc-4efa-ba11-4d663e21bc68,Raghavendr Tatgunti,"दिमि रफ्तार, नो रेस्पांस slow",1
2a792091-bcb8-4f03-bc62-2fddcb80614a,PINTOO KUMAR SAH,not log very fast,1
a03e2372-2ed3-4498-ad78-224cb83e3b0c,Uma shankar,ghatiya app,1
80791c3f-8d96-45b7-b889-a018fec70039,Dr. Chandan Sarkar,"All the Government apps are becoming worse day by day, being unable to use",1
cdfac5dc-3efa-4772-858e-0b8c206ada6d,Dibakar Sarkar,Unable to login since last 30 days. PIN validation issue. worst app experience.,1
29e51e8a-7a04-40e2-8021-219cdb8b7a61,srinivasa rao,it's the worst app. It never works. whenever I login with my I'd it shows verifying but it will not open. so it's better to book through irctc website only. don't trust this app and depend on this app for booking tickets. in single word it's a useless app.,1
cd7976fa-5403-4ee0-8d85-43cf7f2b1e2c,Bhima Dongare,validating pin show all the day I can't login,2
4a0814aa-090e-4b3a-8098-aa62242bdac9,RJ Vikas,worst experience,1
2917aec9-11fe-4fc1-bbe5-b9db3c97fc75,Midhun Sivadas,"The IRCTC app is so frustrating! It always gets stuck on the “Validating PIN” screen while trying to log in. I’ve reinstalled, cleared cache, and tried multiple times — still the same issue. Please fix this bug soon, it’s impossible to use the app like this!",1
c5d6a3de-c4af-4cfa-80dd-39170dbdd50f,BHARGAVI B K,"nowadays the Application doesn't open at all. It takes longer time to login as well, and it won't allow for aadhar authentication which has become mandatory for tatkal booking. there are many technical glitches/bugs which need to be fixed.",1
139522a6-c591-4347-b49e-67fa84353c8b,Ayan Nik,"not working, just loading and unloading",1
a6c2c132-0df8-4d6c-af79-8d3c21c270b3,Mahesh Solanki,worst app. not working on the time.,1
648e8901-648a-4866-9d2a-dc446e66a2ff,Jk Chemistry,during aadhaar authentication I faced problem so that my family trip was cancelled.,2
306adf3e-ba7a-42e4-a80c-8247df1b9b75,Vishal Tiwari,the app is getting worse day by day even after so much advancement of technology! the validation process after entering pin is so long and disappointing! very dull and time taking process for login!! please improve Jai Hind,1
26907b6f-944d-43c6-ba4c-ea1784a63388,Trilochan Choudury,"★ इन दिनों ऐप आपको आसानी से लॉग इन नहीं करने देता। यह लंबे समय तक ""वैलिडेटिंग पिन"" दिखाता रहता है और अंततः लॉग इन करने की अनुमति नहीं देता। यह समस्या पिछले 2 हफ़्तों से देखी जा रही है और अभी तक हल नहीं हुई है। इसके अलावा, आजकल वह वेबसाइट भी आसानी से उपलब्ध नहीं है जिसके ज़रइए टिकट उपलब्ध हो सके इसे जल्दी संशोधन करें ताकि यात्रा आसान हो सके",1
83a5c7de-0d20-4dba-9939-e77462953185,Javed jakirbhai Bhunga,very bad app 😔😔😔😔,1
95fa3f13-815e-45ec-b9e4-55e9cb02d9b7,Payal Hebsur,"Login not working, worst app",1
fbf88948-0842-412c-b3d2-d3b3a7173808,Kundan Saxena,👍👍👍,5
02ff21c7-f48d-434a-b4db-91d16798e7e0,Prabhat Ghosh,bad express everything is not work 😡🤬 wrong username wrong password login this way but you are wrong faking full headache,1
c5e499ba-0f73-45fb-ae9d-b14229afbe39,Piyush Vashisht,"Since past few days, we can't even login to the app. It just shows validating PIN and doesn't allow login.",1
a50e593a-835e-49dd-914f-1933557ea4d9,Akarsh Divyam,"If there would be any option less than 1, I would have given that worse platform ever but you have book your reservation through them only, you can't do anything just be dependable and get affected",1
b70f35d5-1096-4c73-97bc-889b5c3a11ea,Sk Salim,Error! Account 100 India IRCTC 😡,5
a0534f7e-d2f0-4b85-9b9c-4956364f6c41,Rashid Quraishi,good,5
8c81653b-dbf8-455d-81fa-d73911e42367,Shivam Singh,worst application,1
61aacfaf-e04e-44bc-9de4-827bba2f390e,Parth Thakkar,What the hell is wrong with this app it just keeps on loading on the login screen.,1
dba1e075-307b-4338-bcda-4f277e172935,Amit Bangrwa,"22 oct se bahut dikkt aarhi h automatically logout maardeta h.... unable to process request, ip client problem btata h ....",1
8ee9c6ca-5c90-4d1c-a02f-4d3704251504,Taufik Khan,",🥰🥰🥰🥰",5
a01c608b-72ce-4807-a705-373e58591944,Niyas Babu,very bad,1
7d97f9da-92c5-43ce-9290-366b0445f1f6,Andy,No meal option not available for Vande Bharat trains. Please fix it.,1
89640e66-7b41-4810-a50b-85cbeefa0bdc,roshan john,worst app. Not useful for tatkal booking.,1
9172c627-9195-4489-95c1-c460a1c927e0,Sahid Nagori,Nice,3
bd80f61b-5e78-40c6-88e0-c3984f9d45dd,Suman Singha,very bad experience in the app,1
40e6a635-fefe-4685-8d71-e4357235d10f,Aditya Anand,"unable to login in the app for the last 2 days.. only it keeps processing after giving login details.. but if I delete and re-install the app , it logins for a few times.. again the same login issue and keeps processing.. it's really a bad experience now.. at the time of tatkal ticket booking, always the server issue or slowness for starting 5-10 minutes..",2
f02a5bf3-b592-4e64-b4da-02cf4ab6e260,Anupam Vishwakarma,very bad and slow never use this app.,1
18096142-24ef-4a0d-99dc-f5868cc16d0d,U R,day by day irct provide us third grade service log in ho ni hota everytime saw validating pin Not a useful site nowadays,1
ad2ba1bd-eb7c-4d9c-a565-4bae39c4e8b1,SUNIL SAHOO,login issues,1
1a477c08-b1d3-4b60-8011-f0abcabfd470,Sayarnil Basu,unable to login in app,1
f63267e4-7108-4c51-a61c-67b4519fda55,sachin palodkar,worst,1
4a1bef54-a64b-4375-b708-81fa58656667,naman jain,now a days neither login happen in one go nor it displays the seats. kept crashing even in non tatkal hours. pathetic app,1
455f34d0-797d-46f8-a891-dacc8312e1ec,Mohammed Reza,Tried uninstalling and reinstalling app multiple times at the time of login in page is stuck at validating pin,1
99da7915-4d1b-4e15-9393-ae00f43800ab,Deepak Singh,if you can login on time you are lucky ... daily I am checking my luck through this app...,3
bf14390e-6435-4112-b6be-7b47eb86e69b,Dhruba Chetry,Bakwas hai kabi v jarurat k samay kam nhi aattaa hai pata nhi kitna ghumtey reheta hai kuch v search karoo ghumtey reheta hai,1
9e7c5b31-ebcd-4806-a3ae-c7f5779a88b3,sushant bhanjdeo,app is very slow process,1
d4a28c7a-8057-47cf-aea0-cec799dd2fc9,Mustapha Mandewale,"Since the last update, the app doesn’t let me sign in on the first try. I have to restart it every time before logging in, which is really inconvenient, especially when trying to book Tatkal tickets.",1
7b634246-be5d-4c9f-9b49-eb6fd028e246,Aditya Gawade,good,5
bff4a96b-c13c-4941-a607-de2032a08013,Kavya Jain,"I don't understand what is the fascination of IRCTC app and its love for failed transactions.... I have 3 refund pending..... mtlb not everyone is rich, we students have limited money, usse hi reservation karate hai, usme bhi paise refund m chle jaate hai.... aur ptaa chle jb tk paise dobara aayenge tb tk tickets chlii jaeyengi.... but they love to torture us.... never they can improve their app and its thousands of technical issues..... It doesn't even deserve one star... only minus points",1
0a8b1bb9-157e-4a7a-b9dc-ddc490082e47,Taher Doriwala,The app is very good but recently I am facing issues after one login i have to force stop the app clear storage and then login again,4
320eb3bf-09ca-4e46-8a88-c5a12b18d3d4,VISHAL SIRKA,By the way its a government official application then why they are running ads on this app.,2
3c355b6c-2f73-443a-8ada-404ee32b7bbf,Avtar Singh Kalra,now a days it is not working properly we can not chech availability as before,1
c95e02d2-6e29-4478-ad40-4c68012aa88e,shiv ganga sound,very bad,1
1ba14dc5-ea5b-48d0-b42d-43fc022c945f,Govind Vadhyan,not working properly,1
f47fc355-3163-4b1a-a831-1f4167874409,MOUMITA SENAPATI,I'm trying to login it's not allowing me to do that.,1
40880d66-3a06-4a0b-86cc-b8d7d4024232,Vasundhara P,"It is not opening after several attempts since 2 weeks, before that it was very good.Can this be corrected?",1
c19c2a41-de2b-41e3-acd6-eec01de55756,ER Pawan,"Pathic, use of this app is really waste of time. Tying to book ticket but login failed, if login by chance then not showing seat availability. IRCTC officials have to concentrate on this issue.",1
ccf81a0e-2fa5-4767-a74f-5dd671e3eb4f,Rishu Nagsen,it keeps showing Validating PIN.,1
d8751f6a-4603-409f-b7d0-bf91d738ec45,Omkar Parkar,Recent version is closing automatically after searching two to three trains,1
6c13b838-1473-4bba-95c0-46268b224b24,Toon to Tech,why keep on loading the latest version the app after biometric authentication in Validating PIN ? IT'S NOT GETTING LOGGED IN,1
a1b4b726-d517-4bf1-af69-2479cec00834,Asif Vohra,can not book tatkal ticket site is always unreachable can not create e wallet try so many times please help,5
b9066ce1-37b9-460d-852e-7687a8bc64b8,Vivek Singh Government counsel,very good 😊,5
8ffb9f6d-7981-4315-9152-e8e56c1be421,Arpit,latest version keep veryfing pin post entering for too long even endless also. plz rectify this,1
59ad8661-42b8-427b-b11d-ed5dfdb2111e,Chiranjeev Sawhney,Unable to login ever since new update,1
c360b368-1ae5-4de0-a433-ffe3b2db7727,ROHIT BHOSALE,when all time to book tatkal tickets showing many tickets but everytime is service error and not get any confirm ticket,1
60fec412-7a81-481e-98cf-7064b611d867,akash kumar,unable to login.. after entering pin it shows verifying...but unable to login,1
f304bd99-c7fe-4513-a9ec-d78c264200a4,Bhupen Sharma,App Not Working (Opening) when I am entering the Password.. please resolve..,3
76e22c80-a0ef-4933-b028-9a007f512910,Patro Aman,time to help app,5
6581e628-dfcd-4537-83e6-b7b283a719d1,Amod Das,Unable to login getting error like Validating,1
1f1a44c0-307f-47c3-a374-d7afbfebc5b6,Malwad Anant,sahi hai,1
a37e768f-914e-412b-bc64-d4c987235516,A Google user,irctc is a third class service.some days I am trying to login but there is no response.long time processing & finally show incorrect username or password.why this negligence with us?try to solve this issue or totally close the irctc service. Hope you understand clearly!!,1
c0c46294-6bf3-4f7c-b9b7-dde16077eafb,Neelam Nagda,always not working on tatkaal booking time .,1
05fc222b-941e-4260-a524-1fc3baf06d3c,SANJEEV KUMAR,since few days I'm facing issue login in to the app. it's taking a lots of time to login,4
2ea4f6be-d3f8-4f55-9ae5-eca4e2a6f031,manish singh,worst app ever I had seen because the app is not opening whenever needed and in tatkal time not opening the app,1
d3a752f3-492f-4d8b-ad7e-ac1da4ababbf,Deepak Singh,"This app is horrendous during Diwali ticket booking, I tried booking for Godan express 11055 or 11059, it appears all the ticket gets pre booked within 10 seconds of reservation opening, though I tried booking at sharp 10:00 a.m, I was not able to get one ticket too, as it seems it's just a formality to show the seats are available and everything gets booked in less than 15 seconds and the common man never gets the ticket in such trains, its all suspicious which requires deep digging",1
abfa9ca8-f3e9-4c3d-81ea-f530c38db64e,Hariharan K,from the last update it is not even logging in properly kindly notice the issue and rectify,1
968cb0a1-31d8-4c4e-82af-62776cf8c280,aniket kumar,itna paissa tax or ticket ka lene k baad v ek application sahi se nhi chla rahe hai railway Wale . tatkal ticket to hota hi nhi h . sbse bada fraud to railway me hi ho raha h lekin koi bolta hi nhi h .,1
17a51472-bb2b-4332-86ec-2cede8228f14,Aiswaryah Radhakrishnan,Unable to login very often,2
e65a624c-37de-418a-a69f-ee34af7c8595,Vicky Sharma,not logging in for ten days.,1
0f8b7135-4f14-49ff-957e-3b35a706fa36,Taufique Mansuri,best,5
db717fd1-ba1d-42af-ac57-e7525b9b98e2,Bibhuranjan Patra,"very very poor service, any time not open",1
fc68454b-02aa-47da-9321-b9a3cf6a2225,pranjal gupta,not able to log in,1
02ce4c68-8b99-464a-a627-3a34edf0651b,ranjan kumar,last couple of days I am trying to open the app but it isn't opening...,1
7c5aabda-ac51-4972-93ed-43cbd069c231,Jagbir Singh,app hangs while network is full,5
d93705d2-7918-4740-a14e-0de53b20bed6,Afzal Parmar,"from last 2 days i can't login app, only surfing",3
0ce91721-b390-463e-9306-b0332b4b8b0f,Bharat Rajput,Best of Booking Tickets,5
39dd8781-4874-4db3-9156-572825ef1657,ram moorthi,mobile not working proper,1
c2f4697d-f882-41e0-90e4-a1ea464857a6,Alok Dubey,biometric eska le hi nhi rha hai bahut hi ghatiya hai ye aap,1
4bc3d782-90df-4140-aa08-3a45e99ccc8b,Ganesh Soni,very good,5
f016c826-f8b0-43e3-a107-7082fb35392a,Shubham Gupta,very slow to login,3
045c1488-902b-46fb-ae69-ff6d86467395,Manoj Yadav,Aadhar authentication not happning,1
3c133541-a05f-4f7f-9b0b-528b180b9e6d,kanhu charan Sahoo,App. is. not. functioning. properly. we. facing. much. difficulties. in. booking. ticket&. also. serching. for. availabilty,1
6f15c5c8-7f66-4254-b73d-3c923e659345,संदीप यदुवंशी,good,5
42a3d59b-fa89-4bc3-a455-389e26582728,Sairaj Chonche,There are too many loading issues with the app. It is the dirtiest app ever created in the world.,1
bc32b007-ef3f-4b8d-8c09-4336e53d09c9,ADITYA kumar,"from the last two months, I am unable to open app..",1
4711612f-4859-450d-b98b-93b8f98aac49,Aditya Kumar,apps so 😞,1
cde2d290-9530-403f-ae8d-ea8ed7585f00,Javed salmani,very good app for people conveniance travelling,5
4dd52352-371d-4017-9ee1-439d91acc812,Yameen Mohd,1 October 2025 se this app is not propper working,1
486d4f10-260d-4452-9a38-6d739ec1439b,manish singh,this is very bad application and very bad services on this app,1
3e3fd9cb-b384-4883-b019-9449ff1c6dde,BSD HOME APPLIANCES SERVICE ISMAIL,fake citizen uses urctc application longin time is very long and irritation passanger,1
e2d46d9b-fb1d-47d5-8b18-9f0b52b2875d,SHIVAJI BOLAKE,Worst app...Tatkal booking... every time it's showing session expiry while payment.,1
2a8dfe6e-641e-4a2a-914e-0a4b6a2a9dff,Shivraj Lodhi,i will it can maybe slower than other train booking apps and site. But I trust it because it's genuine.,4
33daa775-0043-4f88-a298-7f36c3179268,Sugesh Krishnan,App not working properly,1
8fadd454-0ddf-4d02-ab29-53103b88ba9c,Rajendra Dugad,"can not copy PNR, live status of train not present. Tickets Confirmation prediction not present",1
b423f1b8-402f-4f55-aae5-f70b20e1a938,Vikash Chandra Choudhary,good 👍,5
56e095af-e1ba-4a81-9551-c6949011bef5,Ashok Gangwar,it is worst app,1
f5718624-0e74-4c67-b070-aef705dbf481,Dhamyataa,very very poor. availability search keeps me wait for hours. I have tested. practically this particular app is useless to check availability of seats/births in trains.,1
d041e3e0-93a1-493b-bc8d-2379c7e58fd7,machan resumes,very ill experience,1
0ca95713-9796-42b1-a8d6-31a43fcc4a37,madhan sannad,"Every time I make booking it will allot randomly , even middle seat also.. Which is very uncomfortable .. And Authenticate user has problem.. it will never authenticate .. I'm writing this review while traveling only, this time also I have been allotted middle seat.. bad app experience with this Govt. app.. And much more disappointed with our IRCTC hence they literally allot random seats.. they have to work on this until this , the service is not at all considered.. they are just making money.",1
33d0f774-681d-42b7-84bf-60e1875ac175,Vijay Patel,this version has login issue.,1
c25c3f15-f3fe-4a3f-9b1c-1a8e31a7c6f2,Deepak kumar,good,4
1366e5f7-c8a3-4b3b-bbd9-6bb3e6be316c,joginder sharma,"Trying since many days, not able to authenticate in the app through Pan or aadhar.",1
80c96568-ea46-40f0-90fa-5e584ed651fa,Pranabh Chodhrey,today on 30 th October i have been trying to login into the app but not once it was successful cursor keeps surculing wround and wround.,1
1acef50f-5007-4b77-a31b-8fdd8e79b50c,UMESH BANSOOD,"Mai jab bhi login krta hu validate bohot samay tak dikhata hai or login nahi ho pata,har bar app uninstall krke firse install Krna padta hai",1
35ed3918-61a0-448c-a6f1-912085bd4fca,Harish Dasari,not at all opening always lagging,1
b5a1d401-7352-4d7a-8871-3ea0188eb327,Rakesh Shah,app can't open properly and take to much time to validating password solve the same issue,1
a9db8526-b1bf-43b9-ab92-baae72fdc811,somesh malla,"from past 1month none of the operations are working, not able to login. I don't understand how this is not being addressed as the issue persists since more than a month.",1
8d6442ff-77f7-4818-a754-acd5207ae943,yellala roshan baig,what the use of irctc application. at the time of tatkal booking literally server not available.worst experience it has use only to check train schedule.rather than booking is impossible. pls dont trust irctc application.,1
5795de24-ac05-4fb3-bfea-6643f910d551,Rajeshappanasamy Rajesh,good,5
1bc32aee-c658-4233-930e-0a90b3995e56,Minu Keswani,can't book tickets,1
2f7b95d2-849f-47f2-92a7-127c3f40809d,Nana shinde,"the app is not working properly it's only reloading. since the system has given 15 minutes individual tatkal ticket booking facilities. but unfortunately it's not working on time and anytime when we open the App , not working.",1
eae49b17-db8f-4272-9619-4fa663723431,Kunal Parashar,not able to search train,1
c5afe348-a70e-4106-bcec-3dad52729a47,Diksha Dwivedi,Please help me logout in my device redmi k20 .....my mobile is lost,5
07cf93a7-c309-41e3-861f-fea89fe944d1,prem chinna,frequently facing the login issue. after entering the captacha only can see the popup for validating captcha. and will not login in and cant see errors too...,1
45b2c546-d85f-4b97-a020-7d8def983503,krishan kansotia,App not working from last 3 days...keep on asking pin and captcha ...,2
7addf5e6-3014-4ae3-9731-faf1031beb63,CHETAN VIRA,"After putting login mpin it tells to change password. After entering new password it asks for send OTP which is send on email. Now to see OTP, the IRCTC window has to be reduced. But once OTP is seen from email, the OTP window in IRCTC is gone. So how does one change password?",3
9a375a81-a318-4939-bcc1-4da093459e87,Shivkumar Sitaram sharma,App not working properly some days,1
8f70ee17-0e1d-47d6-915d-696e1f433851,Rajat Magre,"Very worst experience, every time when I try to book Tatkal tickets after completing the full process even payment complete, but at the end result is same Not Booked. Every time Server Crashed. my suggestion to our government please increase server size on peak time to handle traffic.",2
45f9a6a1-ffeb-4a65-a642-306155edbab1,M SERIES,very good,5
65ef1662-f0e0-4930-8521-03f7537d71db,Rikesh Gupta,Easy & good for booking tickets,3
458ba200-b7f8-4133-b999-9045acca93a6,Anand Mishra,Nice,5
9ecaf915-86c8-46bc-8f58-39d142920406,Saud Khan,I can't reset my password when I click to change and write new password they sent otp on my old gmail account which was I already deleted permenently,1
7d80f99b-a297-4799-8c03-0404091365a8,ujjwal roy,good,4
1e49e83e-3b1b-41e0-995e-45c7af585f25,Daud Khan,good 👍👍,4
66926667-a4b4-4300-80fa-1d97a359f6db,Anuj Shukla,good experience,5
03a8d9fe-039b-4183-9ddb-12ed5f3b2618,SUBUDA MURMU,Tatkal ticket booking time slow ho raha hai waiting ticket milta hai,4
5889a6ef-ba43-4241-b1f3-d460cdc648a0,ansh sethi,unable to login,1
67551585-bc23-4fcb-9ce1-4efae32992ba,Shipra Shigavan,"Worst App Ever Ticket was Booked but chart is not prepared ! Review: This is by far the worst app experience I've ever had. The IRCTC app doesn't function properly at all! I booked my ticket but one ticket on waiting so I cancelled ticket but not refunding my money booking ..No ticket, no refund, nothing! The app keeps crashing, loading endlessly, and gives messages after taking the payment. Customer support is useless response or resolution",1
b4cad6f8-a62d-455e-a5ab-e1cc659a9f5c,Pandit Jivansh,app mast hai,4
7ce39359-d04f-4412-ab2b-cbbe15e8b4c5,Pankaj Kumar,mahafaltu application that I have ever used.,1
a35a4f5d-3f96-421e-a252-e600b4ed57ca,Dilip kumar Raman,"now was not able to login , as the verification page is not getting updated doesn't go further to the login page",1
82d298fe-b0b2-4965-8e88-813067f5ae52,Naveen Kashyap,very good,5
fb7ecbed-80c9-4964-9da7-0d0d42bec602,Sourav Paul,"A poor quality app, difficult to navigate and fails to connect to server often. The app fails to login every time and stuck at validating pin prompt on Oppo Find X8.",2
0e4f237e-a949-499d-a386-2e275501472e,Naved Khan,Wrost app,1
cdfb6436-9cd0-437f-be66-bb5a912a41f1,Asg RAJKOT,Useless app for tatkal booking big scam to hold hard work money of people in wallet.,1
2361417b-5b70-47ca-881b-7e376952ee90,Bivanshu Singh,"This app is fraudulent. Today, I attempted to book a ticket twice under the Tatkal Quota for the Rajdhani Express on November 1st. It showed 165 seats available, but both bookings failed. Despite this, a total of ₹11,288 was debited from my account twice, and I have not received any refund yet. This is the kind of service we are getting—this has been my worst experience. If it wasn't for my urgent need, I wouldn't book a single ticket through this app.",1
350f683c-c06d-43f7-9cac-d8cb92bc72b0,MD Wasim,worst app.,1
24844fe6-36af-40de-9605-8fcb81f551a6,Nagmani Kumar,very good performance,5
0cf5fad5-61b3-4ccb-a1b7-1d33b1910d1d,Rk Dhar,IRCTC application very slow service,1
fe595c99-52a1-4b81-8d8d-98ab7dc20703,abid suleman,late confirmation of payment..us chakkar me dusra ticket book krta h insaan....aur phla b confirm aur dusra b confirm....tatkal me aisa hi ho rha h,1
1e513cd3-e1f5-44b0-b576-93969dece431,yugandar naidu,I logged but not open,4
07cbdebe-f03d-42cb-bdf6-dadf94455463,Dinesh Konar,adhar authentication is not happening after multiple try,1
892dbf9c-2980-4cd0-9fff-9e23b2cd9421,NISHANT. N,na kare janab na kare khuda ka kauf kare etna late trains indian railway aap kuchh sahi karne se pahle sharm kare🫡🙏,1
63c9bda4-73bc-44e2-867a-73ddbae433ed,Santha Kumar M,excellent,5
c15774e4-5c45-4725-a7da-b316f10fd150,Hitter Sagar OP,Superb,5
366b374e-b341-44d5-815a-945a64579e58,sud Singh,worst app ever,1
03fd3041-1f2b-4242-9180-aaf94d08142d,Prabhu Sandllo,when I update app i faced login issue not working properly automatically backed 3 4 time trying then login I not booked tatkal ticket booking normal time is not working automatically backed,1
8366c5f2-8c73-4cd3-939f-6e261e7a2415,divyesh nathvani,"Login using PIN or fingerprint gets stuck on the “Validating PIN” screen. It works only after reinstalling the app, but the issue reappears once you try logging in again with PIN.",1
65a2bec2-261b-4018-a2b4-be204a2ebc3a,Chandradev Turi,no tatkal ticket book,1
8eebbed3-98fc-43e1-9580-51e1ba1accc9,Surinder Kumar,best,5
961f5ff9-aa47-4d19-a9e6-d77321785801,Shweta Deshmukh,Not able to login in,1
c11e8451-0f87-43c9-83ae-b811f4322c9a,Chandra Pisharody,poor site. can't trust,2
c445b454-9a3f-4f43-bc4d-68b6c60865d3,HITESH AGGARWAl,"These days the app doesn't let you login easily. It shows ""Validating pin"" for a long time and finally will not permit to login. The issue has been observed since past 3 weeks and is still not resolved. Moreover nowadays the website through which tickets can be booked is also not easily accessible. Sometimes the relevant URL to book tickets may not be available. Quite disappointing....",1
051e4dea-d943-4d5d-b6cf-a646b0fc656d,Mohammad Feroz,"This is absolutely pathetic I had to book tatkal tickets in an emergency and the application kept on showing the wrong user or password to the same Google saved password that I always use. finally blocking my ID for a day when I needed it the most. useless maintenance, on top of that what's up with linking the Adhaar for AC tiers being mandatory and unable to send the verification code to the number of tried linking it to the account. 0.00 on maintenance, UI and Servers.",1
473f8884-fb0e-4964-9ee7-8b6c079a1402,Bikramjeet sIngh,it take to much time to open and is hanged most of time it's required,3
2e0a3760-e1b0-465e-80ee-ebc7d9b5e3f6,Bhavin Shah,"third class management ,I m not give 1 star...poor poor poor",1
f5134142-349c-4b0d-831a-743c83afdaaf,abhishek Ngu,password change ಆಗ್ತಾ ಇಲ್ಲಾ ಇದು ಒಂದು ಆಪ್ ಹಾ ವೇಸ್ಟ್ ಆಪ್ 5 ಸಲ try ಮಾಡಿದ್ರು ಇಮೇಲ್ ಗೆ otp ನೇ ಬರ್ತಾ ಇಲ್ಲಾ ಬ್ಯಾಕ್ ಹೋಗಿ ಬಂದ್ರೆ password ಮತ್ತೆ ಹಾಕಿ ಅನ್ನುತ್ತೆ worst experience.......,1
2924cab9-23fd-4b01-9802-f886be1acee4,sumeet munjal,pathetic app.... i found login problem last a week but no response by app,1
9fe97089-3cc6-41ab-8c67-b8c3a9dbe00d,Rohit Kumar,Ticket book karna hn mere ko,4
72b10515-b297-477c-9e37-f0b93c021148,Mahfooj Mahfooj,support,5
41531d20-5b4a-45ac-830d-b59359f6655e,rohith sk,while redirecting from payment app to IRCTC app for the booking tatkal ticket. IRCTC app got logged out and ticket was not booked.,1
44c15fdd-34c7-41e0-8027-bbc2840c51ff,Khan Waqar Ahmad Sajid,worst ever app I used till date.,1
67af443c-2916-4807-9442-56479f53ad1b,lucky .needs u,"the worst experience with irctc app, because many times when you are booking ticket,the payment get debited from your account but ticket is not booked and the amount come in your account after 4-5 days,and even you can't do ticket booking again,there is rule you can book only one ticket between 8-12,and we got trapped in irctc ticket booking system.",1
d0c98f94-adc4-4cf0-91c3-2b54536cae42,Gaurav Arora,worst app,1
c6a37e0b-a3c1-4033-822d-bebb042f5ee3,Ankit singh Bais,very nice 👍🙂,5
