reviewId,userName,content,score
a1049cdd-01ff-4069-ae23-c7fc8e952503,Prem prakash PANDEY,always problem facing at the time of booking tkt bad aap,1
0ff0f67c-6a7e-433f-a065-3fd193a50237,Rounak Saha,useless app during emergency.,1
8cdb9db3-3d6d-462a-9027-59003729f8a7,Kapil Dhawale,bad experience 😔😔😔😔,1
b5fe19bc-ef47-41cd-a9b7-e6a56e505ba2,shubham kumar,doesn't log in please fix the bug,1
bad6cbbb-1ff3-404b-b63f-c95aca825c9f,vinis s,worst could not able to login buffering,1
f634d824-6ce1-42fe-80a9-2dd44d87fb93,Sourabh Chouhan,only for scams,1
6fbdaafc-a079-4766-83f8-1c386762c596,Nomaan Siraj,app logged out at the worst time possible...and these days feels like booking ticket from it is the most difficult part,1
5d0acc4c-a1aa-44a0-ac79-3852aafef44c,ASHISH MISHRA,"App always works smoothly unless I am trying to book tatkal ticket, app was working perfectly fine untill tatkal window opened, all issues occured simultaneously at that moment, I would like to request irctc to not display such features which can't be used ever",1
de6d6f67-ac9c-4086-a483-c0a6f236c1db,JINNY,the application is the worst ever application i have seen even a lac company would be able to make better than this. Government should use some money to hire better developers.,1
b730131d-8a4d-45bb-b034-1d0853b6c5cd,Jayesh Suryawanshi,This app is of no use to the general public. Only brokers are able to book Tatkal tickets. The app is crashing multiple times and tickets are not booking even after completion of payments,1
01c22641-3102-44ce-a191-b291d841d5c2,krishnakar choudhari,"one of the worst apps, unable to login even after multiple attempts.",1
97946647-72b1-434e-b84d-27f155171e19,VISHAL KUMAR,Worst app sacm this app always error system when ticket booking 👎,1
9660dcf5-3ae1-4302-a3eb-c4c929e21eab,Devesh Verma,worst server crashed daily during tatkal,1
fc85dc3e-e3ae-4186-8cee-9d6b099f3dab,Mahesh kumar,tatkal ticket time me error ata hai hamesha,1
7b6d8437-dd31-4065-857e-d5d9420cc043,Akshay Sonawane,my app is getting automatically logged out after 2-3 mins. not able to book any tickets either in general or tatkal. also while logging in it takes too much time in validation.,3
7c0af783-0904-40c7-aad2-288b35500414,Jadhav Jadhav,worst app,1
0818665d-d0a0-492c-a45f-4baa2d529712,Nasim Auto gas,App slow motion,2
f69d22d2-f741-4e49-8897-9128eb0a8454,nikhil joshi,Error occurred everytime while tatkal booking.,1
64f1095e-76af-4b9e-b216-1634c8925f88,Amey patil,"third class web site, always founds an issue while booking tickets",1
fc8902c5-a4dc-4e6e-8f60-5de711595aba,suryakant singh,"very wrost app,",1
397c8de0-19fa-4777-8ec3-712b0a76ccc2,rishi patel,pathetic app pathetic services,1
15b04732-9b81-48fa-b4d8-8a01176d5d06,RKR world of unique music,for a new ticket timing(8am to 10am) feature is not good for adhaar card authentication user. kisiko agar urgency mein ticket katna pade toh woh kya karega. Aur IRCTC side bhi pura slow kar dete hain railway side se vinamra anuradh hain ki agar aap nahi cahte h ki pehele jesi facility na mile users ko toh aap id ko block kardijiye acha rahega. dhanyawad 🙏,1
43c1e0ed-8250-4dd7-a00a-c90802ac84be,Anurag Ji,worst app,1
befcb8a9-3d38-46cc-b0f0-accf36e68b65,Rock Rosario,Good,4
d9cb1341-b534-402f-a6fd-130fdc030e5f,Abhishek Ahirwar,every time when I am booking any tatkal ticket this app is too slow and not working properly at time of tatkal ticket booking. adds popup on this app too much,1
f581ed4b-b093-4e3a-aa33-9c597318616b,Sharvan Pandey,nice App.,5
fb2c49d0-75c2-44da-98d3-ed6b5d75216d,Rohit Nittala,app I entering password.not opening. please solve this issue as fast as possible.,1
8cc577cc-dffc-4c9d-9b4d-8ebeb881e48c,Ashok Ashok,good,5
eb62e541-cc5f-45b5-a05e-aaa549fd9a9e,Prince Kumar,Worst App Ever Used In My Life Most Worst Appp Not Working At Right Time,1
dfede64c-a2d7-42dd-99cf-384fbbcde6e0,Happiness,"very bad experience, apps not run properly.",1
2416735c-2e83-408f-b215-fd148db917b2,Shrikant Halsikar,for login each I need to uninstall and reinstall again then only able to login please check what's wrong,2
3715246b-3faa-45af-ba8f-ae14c61ad518,Sandy Shetty,"from last few weeks dis app is not working properly, unable to login . but no action to solve d problem is taken",1
d27a425a-8883-4a9a-b7ee-fa8ec856c963,Nilin Kumar,कुछ दिनों से लॉगिन में दिक्कत होती हैं. Only Confirm select करने पर भी वेटिंग टिकट बुक हो रहा है। IRCTC E wallet recharge का शुरू हो गया इसके लिए धन्यवाद। तत्काल टिकट में दिक्कत होती हैं कनेक्शन में और payment में भी बहुत समय लगता हैं जिससे waiting हो जाता है और कभी-कभी app काम नहीं करता हैं .,3
85567acf-99a6-4cbe-8031-6425cc177fe5,Shubham Mathur,These days post latest update app has become practically useless It takes over 5 mins for pin to be validated Even while booking It goes till last page and then gives error that system was not responding try again later This was observed multiple times It's become impossible to book tatkal tickets with such issues with the app,1
f50a58b7-2e5a-4f0a-8711-56dbf9cf491b,Nish Inat,login issues using pin. only able to login using otp. chances of getting tatkal is reducing day by day. App is getting slower and slower. Worst app,1
375b2652-9c84-4eb9-99f2-d2bf2ba4b885,suresh “cherry” badawath,"not responding, not opening, not working. what is happening with application. very poor performance",1
ecaa9464-55c7-4038-b5de-5bb78df1b7e1,Nagmani,Dr IRCTC I want to say please update IRCTC app because it is logout app when refresh to book tatkal on sharp 10 am and 11 am check what is the seen. I think there is any loop hole or bug in app,1
b6d733ce-5328-4ca4-8151-a8e1e4dcf676,Biswajit Behera,It's not letting me log in on the first attempt...It is always stuck on the validating pin but on the 2nd attempt it's always logging in...Even clearing data or cache didn't help...2nd thing is while booking tickets lots of glitches in showing availability of tickets...while doing payment it shows seats are available but on successful payment you will find your ticket is waitlisted..This is not fair at all 😡,1
1ce90fce-f296-4c73-b42a-09e6b909c8a1,Gangesh Verma,Very bad server,1
3bb9321f-8140-4355-a8ab-c0399c722477,Devraj Sahu,Login never works,1
e65fdc9c-80f6-4727-a162-660b081280be,E_Learning Computer Applications Computer Science,Most of the time the app doesn't work properly...,1
6b286e95-ac0e-43f1-9875-946331bf9a2b,Ghansham Geeta,very bad app performance,1
66e0faab-5360-47d8-962a-8446c14ebfd3,devaraj rayavarapu,worst app resources not working good at any time,1
bffebf6a-a4d6-4f2d-b8da-026e6225e56e,Pankaj Gulati,it keeps on saying 'Validating User' but never logs in... it's better to book tickets on web site instead of using this 3rd class app.,1
7a7e46bb-c64e-4820-8456-b2a82b1087f5,akshay mhadgut,App takes never ending time to validate the pin..just like any other Government project,1
3cecbf5a-c272-4bb7-96d7-8ad811c67d68,Prashanth P,"checking credentials stage app is stuck, tried many times",1
5e50a233-ef6a-4c10-9af1-9683ec921839,Shital kumar Mathur,good app. need change of date facilities in IRCTC ticket.,5
900d2414-740f-4ed2-be2f-7f0489780128,faheem akhter FHM,"every time I try to login, 1st time progressbar on validating user id password never stops. killing and reopen the app is only solution. Delevopers thoda kaam bhi kr lo. user id - m_aria",1
360c4969-1db4-47d3-9ce0-7ad9e7f7206a,Suraj Pandey,Irctc app does not go further after the validating pin option and it has been more than a week ...rotating round and round and can't login. After uninstalling and installing it again it's going fine and it is a repeatedly harassing process.,1
56483f8f-da06-478e-8d0b-0c908a0f1194,Ajay kartik,stupid update...,1
3bbb0913-017f-44c3-9148-59917bd9b468,Shashank Sinha,"unable to login, and no resolution received",3
6b911578-5424-4c9b-92d9-0e2c80402e35,Sasha Michael,Useless App,1
452983cc-7b71-47c7-812a-81afd958ca92,Savvy jo,most of the times the app is not operational during the main booking hours,2
f4a8e2a4-d95c-4316-9b3d-703088a423d4,KARUPPUSAMI CHANDRAN,last couple of weeks it's not opening.. validating pin option loading long time.... worst app.. government should look into this... finally unable to book my ticket often..,1
1d46b5be-4104-421a-82e9-14cf28d11714,Aadrsh kumar,not opening,1
7950b48e-3034-401a-99e0-bab746fd4079,jothi prakash,"past 2 weeks I am not able to login at all, it is saying checking please wait then closes",1
6671ed1a-c737-4346-b91e-d5685e7ef723,Jaimataki Jio,Unable to login. Asks for Captcha repeatedly. Went to site to book the ticket.,3
8897c526-2acf-4001-94c3-16b9c0f693c0,a ali,The app has become extremely unreliable these days. It often gets stuck on “Validating PIN” and fails to log in. This issue has been happening for a few weeks now and still isn’t fixed. The website is also difficult to access — sometimes even the booking URL doesn’t load. Very disappointing and frustrating experience.,1
ccd5e146-f6a4-4c0c-ac6e-87c04a39ab21,Sarika T,"I am facing continuous issues while logging into the IRCTC system. Each time I try to log in, I am unable to access my account directly and have to go through the “Forgot Password” procedure before I can log in successfully. Additionally, the IRCTC app has been running extremely slowly, which is affecting my regular work. As I frequently use IRCTC for my professional activities, this ongoing issue has become quite frustrating over the past two days. I kindly request you look into this matter.",1
3b107ae1-433b-477b-99ca-3e68867fcf06,Anuraj Mahato,good,5
5bc2e7f6-4ea3-4054-9bc0-33570237a63d,Uday Kumar,sometime otp for login not taken even though we put otp correct the app shows invalid otp.,3
5da47b29-b746-4244-bd51-1b92d34c5cbd,Raj kumar,Poor quality 😢,2
e1d5fd48-fcf6-487d-bb39-aa38a65818fe,Anish Jain,not working properly,1
b468ad1e-65bf-482b-a698-bc5fc165bcf3,Mandeep Singh,ticket booking time not working 😕,1
30609528-9ea1-4f21-85ec-079c4d10040a,Ravi bohit,nice app,5
8a6283a7-f8f1-4482-b966-8aa95d5bb64b,SHIVENDRA MANJHI,This app is not working since last 3 weeks it just keeps stuck at validating while login And has no update on the same yet I have also registered a e-ticket regarding the same but still no update on the same. What's point of having mobile app if it doesn't work And it's not just for me it is not working I beleive it is not working for any of us I have cross checked that is at an issue for me or all but got same response from them as well that's it's not working.,1
367d54e2-02e6-4a21-9fe6-04829c70c2e4,Jhansi Lakshmi,"not so good, password keeping so long is difficult to remember. hopeless system",3
a23f9e5d-10f3-4f9c-af5b-7404ac6a8209,Hareendran Melath,Unable to login. Getting error as Validating PIN,1
4af02439-f571-42bc-acae-b34f8ada62f4,Yogesh Kumar,I am trying to complete my adhar authentication but every time it show unable your request.,1
ee64531e-5a28-4ef9-914b-e5bf057de4bf,Ravi Shukla,"app shows that i can not book tickets during 8 AM to 10 AM , and i have benny trying to do this last 11 days but app is not sending OTP and finally shows that my my aadhar verification limits have exhausted.",1
18098e8f-f3ac-462c-898e-605da785db81,Gopal Kumar,good,4
5d77aad6-54b5-48b8-b266-2e372b99bd25,Aiswarya V,"its been down for weeks just keeps showing a waiting icon and then goes back as refreshing pin when trying to login, unable to login since 1 week",1
78676454-9243-4f80-bd16-63847ebadb35,Mahesh Meena,app is dying slowly. not able to login easily despite fully updating this. it seems someone has eaten bribes to promote third party apps,1
10c834c5-dc52-4ea8-aeeb-ae96c82ab6ca,Sachin Prajapati,not working properly it takes too much time before start,1
2e28b6fa-ba30-4380-8a30-6d424bc87416,Prasad Mankar,no login,1
3219d5c4-ffc3-4bd0-b78e-603c6dc36665,Sudhanshu Kumar,since last 1 week I am trying to login but after putting login credentials app show only validating credentials for 5 minutes and login not allowing one of the worst app. The people who are maintaining this software are very corrupt and busy in looting public money,1
e4025925-dd4a-4689-af51-619034514d22,ARUN KUMAR,"worst app , not working app is sleeping on the railway track as indian Railways",1
3c533be3-2e8b-44ed-9512-f3a86c3e3aa5,rani chinu,login issues,2
3b568cab-892c-4774-bbcb-9a9a9534a3f4,DineshLilhare DeveshLodhi,Retiring Room application page not opening,1
0dd9df68-8f14-4203-ac31-1fb37ccb842f,Dr. Vishwapriya C,"From the past one week, this app is not allowing me to log in. It keeps showing a “Validation PIN” message every time I try to sign in. Even after entering the correct details, it doesn’t proceed further. Please fix this issue — it’s very frustrating and makes it difficult to book tickets on time.",1
e2d4ee31-f032-4076-850d-ea77d5c16a75,Dr.Mohammad Farhan,Never open in one time. Sometimes take days to open. Very bad app.,1
6ffe55a4-25f2-4a77-b864-9b654e44beaf,Mohammad Ali,very bad now,1
71082e15-916a-448b-bf0f-32125a4251a1,Chandan Kumar,app isn't opening.,1
5f589c53-b29b-4110-abce-6dae745bf3db,Harish Verma,unable to login after trying many times.,1
f47f54da-be51-4cb6-b312-a4d47b393538,Mohammad Nasim,"IRCTC TATKAL BOOKING IS SCAM. I MADE THE PAYMENT WITHIN 40 SEC AT 10AM AND THE APP KEPT SHOWING PAYMENT PROCESSING. WASTED 5 MINUTES SHOWING THIS MESSAGE AND MY TICKET WAS NOT BOOKED DESPITE HAVING MORE THAN 100 SEAT WHEN THE PAYMENT WAS MADE. I KEPT CHECKING DURING THE WHOLE 'STAGED DRAMA' OF PAYMENT PROCESSING AND THERE WERE TICKETS AVAILABLE BUT IT WAS NOT BOOKED. AS SOON AS THE TICKETS WERE LOOTED BY THE AGENTS, A MESSAGE PROMPTED TO BOOK WAITLISTED TATQAL. THIS WHOLE PROCESS IS A SCAM.",1
e37b0095-9a2e-46d6-ade4-dd2c892f4e77,liladhar nayak,इन दिनों app login नहीं हो रहा।वेरी negativ,3
f2a57bc5-9c01-44c8-be1d-c7d82a2aa436,Raghwendra Singh Negi,"WTH is this validating pin error since last 2 week, unable to login. Tried reinstalling app, still issue persists. Is app developer on leave?",1
6c17ad03-c0c0-4fde-88c0-c566a2526dd9,Gitanjali Mohanty,Now a days this app makes more disturbance.Always makes problem,1
d713ec21-2526-4764-a5bc-c0c2026c23e8,Shagun Mundra,slow working,1
c07a0fc0-c498-4893-a22c-dce5a98bbf56,Md Shajad,Good 👍,5
cdbab097-e80a-4dad-af4f-27be072a9f88,hitesh patel,all tickets book from Dallals please solve,1
458ca259-1285-4084-b427-8f6b1c4e768f,GOVIND RAWANI,Good 👍,5
a6e5ed2e-2b8d-4f9b-97eb-21e286197afc,Randhir Pandey,very poor experience now a days. previously was very good service but now disappointed.,1
1d76c413-7f01-436b-aafd-0b966993fd97,Abhishek Mishra,"since Oct 1st , 2025 facing issues in login on the app. Even having 100 MBPS net speed it doesn't allow you to login. Moreover, at the time of तत्काल टिकट app oxygen पर चलने लगता है। या तो जिस कंपनी चाहे इंफोसिस है या और कोई जिसके पास इसका project है उनसे हंडेल नहीं हो पा रहा या user base बढ़ गया। अगर user base बढ़ा है तो govt को इसमें सुधार की आवश्यकता है ताकि लोगों का govt apps पर विश्वास बना रहे।",1
a7c144b6-ca68-45e2-8188-0e63f43b9f87,VIVEK KUMAR,always lagging,1
ee069470-9986-4ed3-bc5d-f11496a934bf,shubham Tripathi (शुभम्),"dear Team, from the last few days I am unable to login in the IRCTC app kindly resolve the issue.",4
dbd6d2b3-616f-4f12-ace1-832c189547bb,Deepak Kumar,not able to login. app crash very frequently,1
17c6b420-0445-45be-afc4-b0202bb55263,SHINEESH KS,stupid app...we need to wait minimum 5 minitues to open,1
dbcb3e92-cec2-4441-8352-3c95a79fe6b0,Saddam Ansari,good,5
7609bdfc-1cc4-47fb-bfbb-11e1162ec9be,sai ganesh patnala,upi payment is not showing for me can you please resolve this issue,1
3e3cf8a3-d79d-404f-a3b7-84a3b46c8111,Jinesh S Vora,"IRCTC app users are facing login issues where it gets stuck at “Validating PIN” even after entering OTP, PIN, or fingerprint. A temporary fix is to uninstall and reinstall the app, then log in with your registered IRCTC ID and password. Set a new login PIN, and you’re good to go. This provides temporary access. Repeat these steps if logged out automatically during your next booking. Tested personally—works fine.",1
3dc4813b-5c21-480a-90fc-216caf0912fe,Abhishek Yadav,"what happened to this app, I have been unable to login for the last 2 weeks, while logging it's showing Validating...... and you are unable to login.",1
3213453a-30c2-44a7-b0bc-4234dae55027,Shridhaar Thakur,"worst app , login problem very bad experience",1
dfd4f4e9-9902-43ac-9ba8-19eb09d26435,Karan Waghmare,useless app not a single feature works properly at last need to depend on third party apps,1
3c55270d-a265-4492-a1a8-c1fb748b1174,Arjun Thoriya,this nice app,5
9eca9411-92b8-4457-bca8-6bd3cd2fadf2,PRASANTH K,Very difficult to get tatkal ticket. Eventhough we are paying money not easy to get ticket.. Showing error many times.. When we will improve from such a scenario... 😥😥😥,1
005e5c5d-544b-48a3-802a-4d70e92ad458,Crazy banker,"only validating pin , no login worst service now. each time we need to uninstall and then install the app for tickit booking",1
54cf032d-a95f-42dc-8c51-1efb7ce911ef,mithun poojary,not working properly... application showing only validating...,1
462f4f13-3f69-4f18-b176-617ba3df2fdd,Md Ahsan Alam,This app is not working now a days,1
d7be5dc5-1283-4469-8c1c-b7bfba481db6,Joseph Gonsalves,Very Dissatisfied with the app first of all it doesn't log in only shows validating and the automatically logs out. I am not able to book tickets or view my bookings. I am very disappointed.,1
ef75ec17-ced6-4c07-abfb-cf53342c401e,panyam adiseshudu,very good,5
b9fa9392-7fbb-4ebc-8f17-32790f23faf1,Sushil Kumar,purane band irctc app men adhar link hone se naye irctc app me adhar link nahi ho raha,1
a7be84e5-3cf9-42fd-8b8d-4b81b85a6dc4,Hari Krishna,by using app not able to login any issue going on this app,4
fb643dde-12f0-4ca3-98f3-5b4399ed05a8,Dr Bhasmang V Dholakia,Getting crashed every now and then. Lacs of ppl are using it. Please do the needful at the earliest and fix the bugs.,1
95fe3d73-89ea-454e-b377-e408b5171dc8,Hemat Patil,niec,5
5bf7a08e-49de-4770-8d1a-c2c3e7562687,md faishal alam,please refresh,5
a15cfff5-b5e3-47ad-b547-b5b609ea21bb,Saurabh Singh,very bad user experience in terms of login 😕,1
2fbf7198-efed-4f42-bc9d-172f418704d7,Madhusudan Ladha,"very slow working,too difficult to use properly",2
5ccd531e-41f6-44a3-9b83-6d541ae3e607,Suryan Sathyan,very worst app i have seen ever in life,1
f4de54c7-1403-44e6-b777-23ea7331da85,KISHAN POPAT,food is good legend restaurant mahesana thank you,5
6532c07a-f193-4344-b743-fe0e3aa0b275,Sushree Sethi,I am trying to login in the app but it's not letting you to. then it showed wrong password. and didn't allow to even reset password. I changed my password from web and since then I am trying to log in in the app but it's showing validation and nothing more. how do even I book my ticket. such a worthless app. please fix bugs,1
210d58b8-079b-4058-bfa1-db2e9ba48fb0,Abhijeet Sarkar,The condition of Indian Railways is really bad; the management system is just terrible. I am experienced is not good condition indian railway ticket so high price and general coaching condition are so very bad condition present time 🤢😡😡,1
8cce3a8d-c232-47a6-a43c-71eb8ebf169c,NAYAN SEN,very slow,1
f7a57dc4-e706-4fc0-a7ce-13ddf9342cc1,Naman Bang,"Lately, even logging into the platform is an achievement. The app does not let me through the login page itself, with continuous buffering for Pin validation. What is going on with IRCTC?",1
6765551f-d56a-4553-b573-006f1f6d4ea7,Sumit Jagetia,Cancellation charges and refund amount should be clearly disclosed while cancelling a ticket. It seems IRCTC is hiding with deceptive intention.,1
507650df-b4bc-4ce1-b6ef-c8fdd4e0b563,Pravin Sahu,"recently unable to login, 9/10 login attempts fail, that too during evening hours,not during tatkal",1
c130b6f0-c9a1-47a7-9ba8-7b6d8bc081fc,Nikhil kumar Mishra,Very poor app is gatiya app me password change nahi hota,1
07e9f68d-1448-4942-9159-f930cbb110e0,#Rankers Classes,do din se khul hi nhi rha kuch bhi,1
bb0059a3-99be-47d0-b222-185a1c022f66,Santosh Kumar,Dirty dirty dirty app. This orgAnisation should be banned from operating in train travel space. If there was a zero star I would like to give that!! They are saying that you should autheticate to book ticket but does not allow to authenticate . Crazy !! Gone mad with such a hopeless organisation ..,1
f8c7f26b-f9ed-42fa-af07-312e4a48292a,Pankaj Singh,jaldi login hi nhi hota.aj 31/10/2025 ko din try kiya login hi nhi hua,1
a5c5899c-c6fa-45ff-9c62-0aa0f69ed5d2,Hiranmoy Subuddhi,app not working properly.,1
ed741d70-a978-4a41-b9bb-f955a1cea5f7,Pankaj Soni,not able to login using pin or biometric,1
e5d80e00-6a6b-40f5-bd0e-a31b94e0a060,Bhargav Patel,Please provide a facility to transfer tickets to close people other than our family. And also provide a facility to change our name online 🥺🙏,3
b5ba1473-8bf2-476d-91e6-c0b82f0cf63f,MD ISHTEYAQUE ALAM,Any time update Ticket Pd mei nhi nikalne laga hai ab 2021 se aaj tak sahi nhi karsa hai,1
93eabfd7-c032-40cd-9cd8-6810143195be,Abdul Kadir,very good,5
067cf9a7-06e2-4379-be0d-11ef8a727c91,Leo Merilali,ye app time se and ek bar me login ho jaye wo hi bdi baat h,1
332d6a6c-8cd2-4d38-9122-9621ac3f406d,sofiyan 07,Best 💯,5
171a3277-874c-4c66-b81e-528cbf5c19e0,Moti Sharma,very slow,1
b4b70449-4e68-4dd1-b530-6a7b4c4d9b49,RAJENDRA PRASADGUPTA,Rail Safar,2
8f359b47-f5b1-4f6f-b67a-61d162742e71,Divyansh Meena,this is very useful app,5
51cad01a-ed62-4903-9e89-3e777c5035a7,Mithapara Rohit,i have download latest version but application is not working properly many processes but opening this app and also face vande bharat train ticket meal preference compulsory no option to select no meal why ?? and refund ticket time app additional charge?,1
3f979a2c-53e4-4fbb-9948-5d1ac6aec007,Deva R Chaudhari,good,5
442fde17-8724-4770-82bc-504a3b51eccd,janmejaya sahoo,"Very poor, too much time taking to open this app.",1
c9cea2dd-f87c-484c-9974-19b71102556e,Saad Khan,worst experience with this app worst worst worst,1
8d97df32-e68d-44fc-abdb-b37619c603fd,Ujjwal Kumar,"It was a very bad experience. I couldn't even login, it just kept showing ""Checking Credentials"" and at the end it also got disconnected.",1
efa91000-45eb-4c92-ba9c-b0a907c39864,Rekha Gupta,app is not working properly validation is taking too much time,1
48037ab8-9685-41c4-8a54-37223c15bb59,Saravanan K G,"Do not let me book ticket in these days,Keeps spinning even the biometric or key is successful.. Losing patience literally.. Utter pathetic experience...",2
f2e9033e-3200-42dd-8cce-5afefc59fb7e,vangapalli kishore,"app is slow and loading, please the government of India, please don't recommend it to irctc",1
791002d8-e51d-4b96-91a5-218d36e1a984,Gaurav Kumar,"Logging in has become a task in the latest version of the app, Current process is- Do at least 5-10 tries, still fail to login Then go to irctc web page and do booking.",3
20b7ec7d-7443-4c3b-83a9-819590952d20,Ratan Roy (Rajib),very slow,1
aae4c4a9-b004-4e3f-84e9-bba5e24cf8b8,"Dr. Prabhash Kumar, Nutritionist","Improve app, server, data storage.",2
2b561ea9-9593-43ac-9df5-d694a70ccbc5,Devnarayan Sharma,not properly working 😔,1
c9c209c1-0bd5-4dac-972d-e28e5c318137,Aftab Saiyed,good,5
b6b5f609-644a-4021-845d-590e22cda6ce,Dr.Shubhankaran Rathod,useless app,1
dc0f0718-80b1-4269-ad60-34bad1a14d24,Rajendra Pradhan,app doesn't let me login for a while,1
1c3d3ce3-4309-4189-a657-6f2eed62c7da,Shubham Tiwary,For the past Few Days Login has become really tough. Kindly resolve the issue.,1
e2c557cb-4ffd-4169-9701-088d90587c43,Subhash Singh,It's not working in my Pixel 10,1
4d0ea95d-80ae-4d4c-a3c3-f7a1af3e5a13,Surbhi Saini,"It is not login easily, very disappointing",1
665aaea4-2532-4456-9ef9-d6b0906f0f27,LAVISH DAGA,so bad experience now days... App opening remains in processing like forever...,2
e8733762-1793-4316-ad2d-3fa1decbfde8,Sk Jahir Abbas,not opening.,2
b7b180a4-74a8-4032-b7dc-996ccfd826a9,Raj,"Buffering for long time even for train search, app is not like to use. If minus rating support I'll definitely rate in minus.",1
bbcca3ab-d783-42bd-b282-f3003726a966,javed,"“The application has a lot of issues; it doesn’t work properly or respond on time.” I am facing an issue with the IRCTC mobile application. It is not working properly — the app often hangs, doesn’t respond on time, and sometimes fails to load completely.",1
cf975342-e89e-448c-a88e-89018bd421d8,Naresh Bishnoi,very good 👍👍😊,5
e9881970-cc7a-4461-86f0-2ed4f75138ae,Arvind Sahu,theek se kam nahi karta Inka app na to karmchari,1
ea6a2271-c150-41f9-836a-25aeed55db25,Binoop Sk,very slow these days,1
93e51692-ec9e-40c9-891d-d28de51181bb,Radha Krishnan,error error error 😡,1
3795b694-b9ae-4db5-ada6-61a6510a357d,Amit Shah,Doesn't go beyond Pin validation. The screen only keeps running at Validating pin and then time out happens and again asks for pin validation... horrible experience,1
57f68223-f169-4843-b6fc-d08fb6f1bfc6,Ravi Singh rajput,worst service experienced during login,1
