reviewId,userName,content,score
bbd688bd-a35e-45f7-b4e2-686347ce93dc,Priyesh Kumar,fully fraud. Nothing good to say about this system and application. Just useless and money gobbler.,1
5ce654af-a847-4ada-acdc-b9ea0bd1a8f9,Devanand Rai,doesn't open,1
96fa19d3-7ce6-4ba3-9a4d-c21e77e0cc7b,Nadim Ghanchi,bhai 4 din se log in nai ho rha hai thodi sharam krlo yaar. hadd hai,1
3b8d8c76-ae9e-4fec-8f05-8ec47a434cb2,Ankit Kumar,very poor service even I can't create account,1
58bfebdc-3809-42a0-910d-45dbbf7fc66e,Aditya Yadav,App has good UI however bit slow in payment processing while booking Tatkal ticket even with wallet it keeps rotating unless all tickets are booked. Recently booke a Tatkal ticket with wallet payment. Afterward train got cancelled and o got refund without wallet transaction charges it should be refunded fully as train cancellation was not due to mine fault.,5
e40ee770-82bc-4400-af92-741a0fff2eda,Mohdyahiya Shaikh,properly nahi chal Raha hai,1
fbac48ef-5083-4ee6-852d-c4bc132a5135,Shohin S Kumar,"The worst app that is developed. It asks for me to change my password. Once the otp is sent to my mail, the moment I switch to mail and comes back, the password reset page in the APP is refreshed and asks again to change the password. What a terrible App. Basically this process is now a never ending loop",1
bd2da214-c8ed-4064-8e15-4ec122b79110,Tapas Maji,Good,5
a4c95261-ab0e-47f5-865b-de6f685fc393,Shamim Akhtar,The app is malfunctioning since last 10 days. it's not opening and everytime I've to uninstall and install to open it.,1
8d369207-fdf8-4720-9add-4ccff3edd881,Anshul Mishra,very bad service,1
1e8f4670-32d8-40c5-b1df-d1a182b116ba,monill shah,not able to log in on mobile app since 4 days complain not twitter n on the equery no solution yet .... have to uninstall n reinstall to log in,2
53a7d499-f400-4fff-b319-53574bff2d25,Nilesh Kulkarni,third class railway,1
0c038847-75cb-45a0-a31c-8dc3c922c59d,Pallavi Verma,"The app is not working properly, every time it has some issues, after the maintenance yesterday I faced login issues. I had gotten less refund from irctc due to their technical glitches and site problems. I was not able to cancel the ticket before due to the login issues in the application and website both. I have contacted their support and query feature as well but no response even after sending mails or raising queries.",1
9b930448-22ba-4999-924c-bb46061be26d,Hyder Ali,"I recently lost ₹315 while booking a train ticket on IRCTC. The system showed “available seats” but after payment it became “Waiting List”. When I cancelled, IRCTC deducted ₹60 per person — without ever telling me the refund rules clearly before booking. As passengers, we deserve transparency. IRCTC should show all important details before payment, like: Whether the ticket will be Confirmed / RAC / WL Exact refund deduction in case of cancellation Realistic confirmation chances",1
5a6706a7-db12-424e-8e1f-60e3535c20be,Rahul Gaur,nothing works on this app,1
ccf6c4c7-4236-4745-bd16-8c3c2e82448e,Dr. Ritwick Banerjee,All the software engineers who made this App deserve a standing ovation. This is what happens when engineering students don't study properly. This App is a perfect example of that. Nowadays a class 11-12 standard student can code better App than this ridiculously buggy and poor UI app.,1
743b4bdf-1d9c-43cd-90e3-22897644eb45,Narendrakumar Prajapati,why they don't have negative star marking worst app,1
6d247b48-0a10-47d2-b768-6be05ecf5e18,Maneesh Jaiswal,Good performance app,5
0e7afe52-b3e3-4233-8433-d451af50a822,Praveen Agrawal,"Bhikari GOVERNMENT ki GST VASOLI, 1 to Ticket k dynamic charges uske uper convinient fees vo bhi GST k sath, platroem fees, means public ki earning ko lootne ka koi tarika baki nahi chodo, or new new fees + Tax add ker do pure rail staff ki fees bhi add ker do, public ki pocket me kuch bhi ₹ mat chodo. sab kha lo, in case railway jab khud train cancel kare to usme bhi refund pe GST please add 4 other convinient charges + GST there also. 👎👎👎👎👎👎👎👎",1
62f69d7f-6c69-47ba-94ad-675bb6b28c8c,Parthiban J Krishnan,"I can't add money in wallet because the maximum amount is zero. During TKT booking I'm always getting waiting list, while payment it is showing ticket availability in double digit but after paying it takes 5 mins to show result as waiting list in double digit.",1
48830a83-0cfd-4ba1-b052-f4b588ce49dc,Deepanshu Sharma,app is lagging so much... whenever i start the app and search for train booking the app lags and i have to restart the app for booking,1
f2bab6fd-3db3-4362-99eb-c07f562b99a2,Stym,"worst application , doesn't run smoothly",1
8c276b59-9992-453e-a1ea-0622bce58f81,Aman Roy,Very Bad Application,1
3d5fb0db-9428-43bf-b1ec-894d8c7a2ed2,Priyansh Vashi,Excellent updates daily.,5
6eb540dc-8bbe-428a-99f1-a563b6b9e1bc,Manish Yadav,bakwas hai irctc payment kat ta hai or servar down,1
c387a118-c04a-44c4-8c3f-8c82ce62e1b2,Raj Indulkar,"Last night me and my wife, Travelled from Kolhapur to Mumbai in Mahalaxmi express - S3 seat numbers 73 &76. would like the authorities know that the toilets in this compartments (both sides) were very dirty.. many people, especially ladies refused to use the toilet. Its the same story always, the tiles stinks, expecially when you have your seat at the entrance of the bogey. the authorities should take note and keep the toilets clean.",2
b2f9aa9a-2914-4abf-92d1-c668483d4572,ANIL SONI,app not opening,1
347bc3a3-6ac2-4a1b-95a8-306f70f93203,Shahajan Choudhury,Worst Performance very very disappointing.,1
0f89a1aa-d55d-4b98-b20f-c587946d9978,Gagan Sahu,"It is a useless app, it keeps loading all the time. Sometimes this app does not work",1
27595813-1285-4165-9724-fed159274793,sudhakar jayaraj,The app does not open easily and it is buffering all the time especially these last two days,2
c0423092-2f5d-4e88-a554-2217b9a81a47,Abhishek Pandey,"Worst app...what you can expect with the government app.. Every time when I try to book a tatkal ticket it shows that ''This site is currently unreachable"" or ""Unable to process requests """,1
d531cd77-6764-4ced-abb8-241f5e0c68e6,Yogesh Kumar Sharma,not open after one day or two days use to irctc for login train confirm ticket.via PIN no.,5
adb7c411-2b4b-4cd5-bd20-0e3634e91583,baghudana subramanyam,"Very poor experience. There is a prompt to change one's password. When I switch to my mail to check the password screen refreshes, making it impossible to change the password.",1
18f829c7-4a72-40fb-8127-753f6a6dda0a,K J,worst ever,1
eacc8a3c-224d-4b68-b66d-a80f651a1c1c,Rohit Sonvane,"worst experience, I was trying to authenticate aadhar from last 1 month and app keep saying ""error processing your request"". but when I tried from laptop the error was my name on aadhar was not matching with irctc account name. even after knowing it I was not able to authenticate because I exhausted my aadhar authenticate requests. why can't you just display error message on app properly just like website .",1
355f1889-fcd2-4867-b8af-99ab22798316,Nitesh Kumar,Very Helpful App,5
8e3aa4e5-0b5a-4d66-9318-0fe1419a554a,Md Rustam,This app is best than other app,5
f425d981-6c9a-43a6-a75d-3a42d5504cc5,Rupesh Dhage,Very poor app. Most of the time not loading after validating pin stage. Poor response from customer care.,1
4f8ac470-e163-4637-8a6c-7524ba83af8b,SAURABH SAHANI,You can never book Tatkal Tickets from this App. Application server gets overloaded and Error Message Appears on screen during Tatkal booking time. Application of No Use.,1
0a2cd63e-d0c1-4898-bd4d-f24dbc04b83a,Amit Yadav,after a long time irctc has created a new history they have there own problem centre now this time they a new one ( there seems to be a connection issue with your request . please try after some time. one more issue is ip address 😀) dalal se earning he karni hai toh app mtt banao na,1
3c3df42d-f7fc-4bb0-8946-ea421bdb59e3,Sujeet Chourasia,"One can never book a tatkal ticket from this app Even after verifying my aadhar I am not able to book tatkal ticket. Money will be deducted from account but the app will show nothing ,after few minutes it says your session expired. It happens every time they will TAKE YOUR MONEY AND RETURN IT AFTER 2 TO 3 DAYS YOU DON'T GET YOUR TICKET + YOUR MONEY WILL GET STUCK FOR 2 TO 3 DAYS. If you can't give tatkal ticket why even bother to give us the option for tatkal booking.",1
87fa9a77-2b0e-40a8-9eb7-dfbc1ea82b51,kunal patil,Bhangar application....,1
240475d9-f1c8-4a1b-b09c-5af6643118e9,Adesh,useless app,1
2ab0dad9-8bba-44de-9c5a-ece941e1d5fb,Anshuman Trivedi,"Very poor app for e ticketing.During tatkal hour, booking is not possible than what is the need of this app? Now the time is came to completely privatised the ticket booking process. After complete privatisation of ticketing process it becomes easy for everyone.",1
a4d06512-4d4c-491b-8a44-d7ab758302f0,Kiran M,"Worst app ever! Keeps logging out again and again during Tatkal booking. Payment fails, shows “IP blocked,” and money gets deducted but no ticket booked. Takes 15 mins for one ticket, always goes to waiting list. Horrible experience, useless app, needs serious fixing! 😡",1
625586a5-efa9-49fb-8645-ca36e062bd6f,Kanchan Singh,worst App,1
dd4860da-004b-4e40-9ab8-a42d5dab4866,Priyanshu Vishwakarma,worst app ever seen,1
2b1003af-8a17-49ed-8fe2-db041e3cb7ce,SAKET SAURABH,it's fabricated,1
e48d3615-71f1-4a7c-ba6b-d129a51c845d,I H,IRCTC interface very bad and ticket booking 2 month waiting waiting waiting,1
d6bbcf5c-12dd-4da2-9132-c27e926cb3a1,Life style,"very bad experience This is all the fault of the railway people. India has progressed so much in development, still these people deliberately spoil their server. Improve it. While booking Tatkal ticket, they are logout. This is very wrong for us middle class people. 😡😡😡😡😡😡😡😡😡😡😡😡😡😡😡😡😡😡😡😡😡😡😡😡😡😡😡😡😡😡😡😡😡😡😡😡😡😡😡",1
235b7c55-d75b-4f7e-9a36-36a39f98d525,Yash Raj,"fix your server,wrost app",1
c7cdca72-90f7-41e8-9435-68f39f6505f8,Mandar Thuse,Not working asking password change again and again very bad experiance,1
37f39a44-7bd7-47f7-acc8-ecf2525f0959,Pranav Sarode,Very useful for booking tickets and checking status,5
3520822f-7077-4018-92f0-e3c4b26602e3,Devprasath Gunasekar,verryyy worst server ever I have been seen worst appp,1
5cb621eb-4b86-4ff4-b748-fd2ef9cde477,Sanjay,now it is not even logging in. pathetic app,1
46e5c142-d051-4bd8-b765-5945ff8e7601,NINAD SHAH,Biometric opp not available now login problem from last one month all time sow validating pin,1
5b9ee63c-0650-484b-a530-75717e94a938,Anjanikumar Pandey,take too much time for login. Every time the cache cleared required.,1
f17a330a-1521-4251-b60d-662d359d92df,Raja Biswas,always server unavailable disgusting app,1
a1fecff0-f6a3-4690-bf4c-20376b9f5d4a,Pawan Kumar Pandit,Does not work.,1
9c6c3f29-cf6d-4d65-9874-8ae692704e8f,Himanshu Verma,"the worst UI the worst experience. You guys should get your app developed from a professional not a freelancer. Edit after 2 yrs - Still the same thing. ""The worst app in the world"" award goes to IRCTC rail connect. Kudos you have kept the spot unchanged for many years.",1
bcc08c5d-926a-447e-8fb4-24d7c82355d1,Sayak Chakraborty,don't use cheap software engineer,1
553bd4e4-a5c2-4a2c-a113-cb475854a34b,Roy,"Edit: If there was an option for a star lower than 1 I would give that! First of all I hate the tatkal system. The tatkal system is so good that an error message keeps popping up saying I have a connection error but my wifi even with a speed of 300mbps can't help getting a tatkal ticket but the ads keep running. How nice, IRCTC. I spam the next button only to see another pop up saying 'unable to identify client requests' and logs me out. Adhaar link for stealing passenger data and display ads?",1
4f286b9c-70c2-4bf2-bdf2-6b3f6e30d41d,Pawan Jain,Good application,1
2b01a924-aef5-4166-b4a9-8922a76d0e46,Satinder Kumar,good,5
d856347b-f284-42d4-a1ce-0e52035a6d42,Ramesh Rathod,application not open many time,2
8310b5c7-160c-4076-8b9f-452dd209d4ef,Shiv Kumar Mali,good,5
3fec5d82-ebcf-4a99-9234-30e070225302,Chandan Rajbhar,irctc app is not working nor is the booking facility correct,1
f11d0dd8-8a7c-4ac0-8fe6-a6045f95be44,Kamre Alam,why not open this site app,1
0f5f78e5-3237-4d85-9ee9-0a3d01800691,Vivek Gupta,Nothing can be worse than this. Never install. Don't they have an option to give minus five stars as rating?,1
eb6375b6-0134-4f29-8103-31302a74effd,Mahendra jangid,"Very poor app ...when I book taktal ticket app shows unable to request page very bad , very poor app , it immediately kickout from app",1
1807dc3c-3309-485d-9dc0-21fc17ac1c25,Dheeraj Kaushik,totally frustrating . i tried multiple times to book a tatkal ticket but every time app crash and logout my I'd.,1
0588f649-ea2d-4eef-8337-a97c71a36fba,Shivam Gupta,this is disgusting the password or username is not matching or when I forgot or change the password it's proper not change and give phone number reason or email reason extra extra,1
4fa8ef99-f066-4cf0-b2b3-3fc2afd8a783,rahul govani,cancel ticket option not show,1
882ecb4c-f505-4c55-b5cb-50fee3a8af07,Hitesh Mav,not working properly,2
0bb5cc09-0982-4ee3-87e0-94ccb3cf533e,Pushpendra Pratap,vulnerable to use,1
740f931b-4adb-4086-b174-8e749ad8b55b,shankar swami,"I tried to login but didn't, there was no error shown on the page, every time login issue even finger print authentication successful.",3
ba7f6ddc-461f-4474-847c-9e509fcc9e85,mayank bharti,ye app kalse open kyu nahi ho rha. Every time I am trying to login it always says processing and failed,1
e69e9183-2a83-4ce6-88e2-884a61f71af8,suresh,useless aap and people,1
2ebfc7d3-3d7a-454c-8382-0dfc3867f363,Samiullah Bagwan,"Reservation made easy, Kudos to Indian Railways. Thanks a lot IRCTC.",5
546d3878-98ef-42ff-99a6-3d219046e90b,Shailendra Kumar,"from last 2 days I am trying to cancel my online ticket. But not able to login, app not working",2
77e968ec-ef1a-4d70-9ac2-cd6bbe4b6f8b,Shivam Bhardwaj,irctc aap work is not properly,1
7a0fe6f6-fa1c-495e-9b6a-f52315247727,Raja B,it's keep on loading,1
bc2c05e4-2d3a-485c-a15e-afd6110344a6,PANKAJ SINGH,I unable to login after update the app,1
6cd7486b-ff01-458d-a27d-052f8e3dfc2f,VARUN KUMAR,tatkal ticket never gets booking app always hang shows error,2
9f5d92eb-5bff-4a56-b23b-9add319a227e,Mahima Singh,it's the most pathetic government app. it's so exploiting In nature. problem is in their server and we have to suffer almost always,1
dd7b469c-9d1c-48f8-9baa-7b245434fda7,bharat Sakaria,app updated on 1 November 2025 but regret to say that after update it's not working what is the use of this app if it didn't work when required Earlier version was good and smooth function but it's worse today it didn't open when I require d to book a ticket,1
d451f99c-7d30-4b3e-9421-2d794d83ed4f,Prajpati Prajpati,Best,5
c0a51313-2a8e-4806-bc34-eda9249f0184,Santosh Keloth,This app instead of Improvement the operating functions are very poor now a days. Once you open you have to refresh for checking the seat availability and fare and most of the time we get the message the app is not responding. I have written the above message long back but no improvement,1
d97fbc5b-5d1f-4718-b618-933379067c81,Akash Chopda,since one week unable to access my irctc rail connect app provides everything whatever is required but the app keeps waiting time too much don't what's the issue with app or any kind of bug or malfunction of the I hope this issue short it out soon I request the responsibility of team please look into this issue and solve it ASAP,3
995b1cdd-f93b-4936-9cfa-6367f7b3d0a8,Murali maddikunta,bad net work,1
7c4be6fb-fa61-422a-ab7e-d036b914bcce,Vikas kumar Ram,not 🚫 response,1
f7bf9343-073b-4116-ae53-01876c760c67,Aman verma,"what a waste app unable to authenticate my adhaar and the population of the country sucks, like you can't even have 10 minutes for booking tickets cuz all will get sold out.",1
e825d341-3840-47fa-87d4-bdf46b47f03d,1318 Smit Vira,worst techs bugs and glitches everytime,1
18711dc4-2958-4f6f-8d16-b84f3db238bd,tiiw arii1,Grate Applications everything is good like booking & all but Tatkal Booking system is mustly have to more helpful by not lagging on the time... Railway have to add an option for ordering food directly from pantry as per PNR no. given.....,5
243def0c-533a-40b9-93dd-02b65180e05e,Surya Prakash,"The app has become increasingly unreliable lately, showing various errors that were never encountered before. It’s especially disappointing during Tatkal bookings, where it often logs out unexpectedly and takes an unusually long time to confirm tickets after payment. The developers should personally try booking a Tatkal ticket through this app to truly understand the challenges users are facing.",1
8a9c8c4e-b5f7-4a5d-a007-f1173da16609,ARUN CHAKARI,super,5
7b5db084-9924-4592-916d-261beeb7fc9a,Ravi Kella,I am not able to login to the IRCTC App from the last 10 days onwards I tried uninstall and reinstall again but no lucky. please fix the problem,1
c142e15a-a14c-4ab4-bee5-348111ff2727,K.p. Kannan,super,5
ce563b76-18fe-4bbd-aae3-80d790781ea1,gaurav singh,buggy after latest update,1
3383c001-d211-4974-92b1-9763992c7c03,Ajeet Kumar,"When booking Tatkal tickets, you are prompted to log in. And there are a lot of problems booking Tatkal tickets.",3
f16cd9c7-ced2-4154-9ef6-18200e5da844,BRainbow,worst service.... high speed internet connection still keeps circling.. unable to do adhar authentication. show some sincerity railway walon.,1
1f7a4614-e68a-4228-be49-89c8879d6c8a,Syed M Kaleem,facing login issue after entering password stuck at validating pin and won't login. have to clear cache everytime to login The worst app ever,1
43fe3b90-5c97-4463-b937-6ea4285e8f4a,Anthuvan C,It is not working in my Android device. it is keep on loading in validating PIN itself. not moving further.,1
e82e9464-e11a-4ddb-840d-7ec99cdf541c,Tasauwar Husain,too much advertisement and more time show data not retrive again try and again try.,1
df011d9e-2830-47a2-aedf-adfab20690f3,Akshay Mani,bad service 😏,1
dd4673dc-0d86-4de2-be6c-9191ec8870de,muhammad yasirjamali,No mobile number change option so I couldn't use,1
bb0cc3fd-89ed-43de-ab21-4f508effe0a0,Madh1 Rockz,login issue,1
6e1a2e62-052a-4306-bd55-8b80885f8d0f,V Chauhan,"Booking Tatkal tickets from IRCTC is a very bad option. When you go to book a ticket, it shows a lot of tickets. Even after the payment is done within 1 minute, the app keeps buffing and the ticket gets booked waiting . And if the waiting ticket is not confirmed, still your money is not refunded in full. In such a situation, IRCTC will deliberately make the waiting list very long and even for the waiting ticket which cannot be confirmed,This is a fraud with the user.",1
f9b0d0ac-ebfd-41a7-a546-0ee8be3f928a,Ashad Khan,"world's jhantu railway rule for booking tickets , even your children are booked apart from ur family 😡",1
b5ed7a93-3c20-4ea5-920b-53d0fd259741,gaurav kumar,one of the worst app,1
42e42dfa-84cd-4d57-84d2-a77c670c989a,Bhanu Prakash Choudhary,The app has suddenly slowed down. Unable to even log in,1
3eb196a8-cd28-41cb-abf3-3538673bd5d6,A Vishnu kumar,"I find this app's core features useful, but I must flag two major areas for improvement, especially given it's a train booking app. First, the performance is noticeably slow. The lag when searching for train availability or loading the final booking pages is a critical flaw that needs immediate attention ​Second, please consider adding regional language support.",2
8c493d99-8e4d-415d-971e-c46dd66a8af0,krishna,one of the worest app i am booking ticket from last week takkal quota i am not getting only that too same time same train i have the proof if amount debited ticket is not available if money debited ticket is in waiting as soon as you open at 11.00 pm they will throught u out of the app now what is the value of addhar card verification done no value scam scam please reply,1
f1e0fd7e-e897-417b-9e8c-1dc86124972d,amitsing rajput,best,5
ddea1f0f-eafe-4588-a7cb-cf6b3d7f469d,pavan jatar,worst ever,1
2823990c-04b5-48ce-ba40-0f8abfc235e2,venkadesh kv,App stuck in train search screen. suddenly this is happening not able to book a ticket.,1
62e4b62f-9140-4b52-b067-20f9e61cab3d,Sudeep Veer,pathetic app takes a life time to login every time have to uninstall and reinstall to login wish there was an alternative app that can end the monopoly of IRCTC,1
1bec95cb-f3d8-47a8-985d-a3c0474fe9cd,Rini V,90% of the time the app gets stuck at validating pin these days.,1
875deff8-6b6e-454b-9598-9a9ac082f07d,Saddam hussain,Best but always one problem faced unable to transaction etc..,5
fc321cd0-9f1f-4e05-a978-db3cf9a487b2,Akshat D Cool,auto logout and not able to log in again.,1
4d26dc50-8eca-48ce-9789-27c5449ce66f,samala stina,"App is super glitchy, won't open most of the time, and reinstalling only works temporarily. Booking process is painfully slow even with good signal. Couldn't complete transactions multiple times due to slowness. Earlier, it was much smoother and faster. Needs a lot of improvement",1
ba5070bb-a254-4550-93cb-67626cf85cc7,Palani Baskaran,when ever I am going to ticket booking not working at All time,1
0a7d2e43-8b34-4e98-a961-388c9d95cc71,Gourav Jadhav,chalato chand tak nhi to rat tak,1
c910fa8a-e926-472c-a82a-e50326e4ec53,KRISHNA KUMAR GUPTA,Worst app to use,1
ddfb4c41-6949-4b2a-ba46-71dd742c349e,Samiya Khanche,app is not working. also Its showing validating pin,1
014246f8-b048-4e74-843a-bdc89588a2d3,Ratheesh Kumar,not opened,1
ec48ea09-8f80-4c1c-960e-11cafd0ec7ba,Om prkash Singh,very bad app,1
49a07ff0-2165-4e61-bac4-4d79f84ffd19,Ajay Kumar Sharma,very slow,1
076d5d66-4ced-4fa0-b1ac-f90927803b95,Jamal Uddin,worse app,1
0634e829-c1f4-4250-9c2a-d6ae3ba23fe7,PRITHVINATH RAM,good,5
f207908d-20bc-4e87-a1ae-57007d567436,Lahari,worst maintenance,1
bb99496a-f7b1-4f53-8c2c-438ea484e5d0,Anuruddh Kumar,"This is a terrible app, nothing works properly, it doesn't work when needed. Absolutely terrible and useless.",1
b54bac04-cf85-4be2-93c4-1de48b33b94a,Ashutosh Meena,"बहुत ही बकवास हो गया है आजकल IRCTC, लॉग इन होने मे दिक्कत है बहुत, तत्काल तो भूल जाओ इससे कैसे होगा राम जाने..... मुझे नहीं लगता इस रिव्यू के बाद भी कुछ फायदा हो।",1
a67ff369-e8de-49f8-8b5c-54f5f1e82724,TASLEEM MUGHAL,good,5
0d4c276e-1e1f-42b3-b5d5-1ec2687b59aa,Ashif,worst app. can't even login in general timings,1
9c26c409-e0ca-4989-a047-bc53cd350ec5,Manav Jain,"Many new issues. 1. It seems that they have now made some shady deal with MakeMyTrip where IRCTC now shows Waiting list for seats of Vande Bharat train, even many days in advance, but same tickets are available on MMT for double the price. This is for tickets numbering in 200-300, not some small number of tickets. According to me this is fraud with the general public. 2. IRCTC app has stopped showing the option for 'No Meal' and forces one to choose between Veg or Non Veg meal.",1
d79fa1b5-6174-4fde-9967-7786730c9f7c,Madhulika Kumari,from 4 days i ambttying to login i need to book a ticket the rubbish app doesnot open. what's the problem spend some money on app railway ministry.,1
66645549-b569-43dd-8716-bb6371204a2a,PARDEEP KUMAR,very good 👍,5
347980e8-9fb4-45ca-aa9c-f00280a8d4dc,Amarsingh Kushawaha,third class app wallet for rupees cut and fail for receiving 4 ya 5 days,1
9376e770-2aa9-430e-880d-329c97894a04,AVINASH SINGH,App not working fast from 2 months,1
bd8ef720-e8c3-48c6-a9ca-9e3cae00534f,Sk Nasir Sk,nice🤩,5
6e9a695d-f012-47fb-a878-2d592593d2fa,Rajeev Ranjan,The train toilet is not clean properly with a very bad smell and very old coach,1
c6f4b4db-993b-4d6d-bff1-669d7726cd1f,vishal motwani,app is not opening,1
55b0b64e-ea7d-4b02-bae3-d6f7c1c9d4d6,sonalika dhiman,worst app ever,1
7aab20d2-31b3-4ceb-8548-894c8121529c,Satish Meena,excellent,5
3a05434a-9108-42aa-947d-f312c77abf3d,Lovely Manhas,bad appp no downlod this app,1
2354fb7d-2527-4026-bb76-1065d8497369,Rajeev r,"Login interface in painful, Booking experience is bad, while booking by mistake we tend to click on Ads. Login is failing since morning 1 nov 2025",1
7716df46-547f-4ac5-ac72-a93904ef934b,Rajib Banerjee,Too good,5
e14f796c-eb0d-4a7d-9c03-69fb380b82a3,Jitesh Buddhadeo,Good servies,5
a6e6c167-9730-4719-ae5a-1012fc7e4b37,Shivam Jain,"App is not getting login through biometric or pin.. Everytime I had to uninstall the app, re-install it, and then need to login through username and password.. Facing error since long..",1
14104e29-143d-4a4d-9397-fbf953aea881,Romanchal Naik,best aps,5
2d18069a-43ba-48e3-9b25-7c7cc7af1c7e,Sithin,"Please remove useless ads, fix performance and functionality issues. Apps like ConfirmTkt are user friendly. kindly use that app and learn from it...",1
5e0dcabb-6db2-4c9f-a3f9-c4a95a44bae8,Azeem Shaik,Now a days its became too slow to open the app its hoorible to see the status as well,1
4e97ca99-1352-4cf3-bb29-ab41325dd3b8,Mukesh Dhorajiya,"Hopeless and third class, TDR not file, only error error and error..",1
4835f3ab-972c-4b30-b852-ecdecea56f65,Dinabandhu Giri,"These days the app doesn't let you login easily. It shows ""Validating pin"" for a long time and finally will not permit to login. The issue has been observed since past 2 weeks and is still not resolved. Moreover now a days the website through which tickets can be booked is also not easily accessible. Sometimes the relevant URL to book tickets may not be available. Quite disappointing....",1
